DOMANDA 5.2#I pubblici impiegati, ai sensi dell'art. 98 della Costituzione della Repubblica Italiana#sono al servizio esclusivo della Nazione#non possono conseguire promozioni se non per anzianità#sono tutti soggetti a limitazioni stabilite per legge al diritto d'iscriversi ai partiti politici#assicurano l’equilibrio dei bilanci e la sostenibilità del debito pubblico
DOMANDA 5.3#Agli impieghi nelle pubbliche amministrazioni, ai sensi dell'art. 97 Cost., si accede#mediante concorso, salvo i casi stabiliti dalla legge#mediante concorso#mediante assunzioni obbligatorie ex lege n. 68/99#mediante selezione non pubblica
DOMANDA 5.4#Le disposizioni del D. Lgs. n. 165/2001 e ss.mm.ii. disciplinano l'organizzazione degli uffici e i rapporti di lavoro e di impiego alle dipendenze delle amministrazioni pubbliche al fine di:#accrescere l'efficienza delle amministrazioni in relazione a quella dei corrispondenti uffici e servizi dei Paesi dell'Unione europea, anche mediante il coordinato sviluppo di sistemi informativi pubblici#conservare l'efficienza delle amministrazioni in relazione a quella dei corrispondenti uffici e servizi dei Paesi dell'Unione europea#razionalizzare il costo del lavoro pubblico, incrementando la spesa complessiva per il personale, diretta e indiretta#realizzare una normale utilizzazione delle risorse umane nelle pubbliche amministrazioni, assicurando la formazione e lo sviluppo professionale dei dipendenti, applicando condizioni uniformi rispetto a quelle del lavoro privato, garantendo pari opportunità alle lavoratrici ed ai lavoratori nonché l'assenza di qualunque forma di discriminazione e di violenza morale o psichica
DOMANDA 5.5#I rapporti di lavoro dei dipendenti delle amministrazioni pubbliche sono disciplinati#dalle disposizioni del capo I, titolo II, del libro V del codice civile e dalle leggi sui rapporti di lavoro subordinato nell'impresa, fatte salve le diverse disposizioni contenute nel D. Lgs. n. 165/2001, che costituiscono disposizioni a carattere imperativo#dalle disposizioni del capo I, titolo II, del libro V del codice civile e dalle leggi sui rapporti di lavoro subordinato nell'impresa#esclusivamente dalle disposizioni contenute nel D. Lgs. n. 165/2001, che costituiscono disposizioni a carattere imperativo#da disposizioni di legge, regolamento o statuto, che introducano discipline dei rapporti di lavoro la cui applicabilità sia limitata ai dipendenti delle amministrazioni pubbliche, o a categorie di essi
DOMANDA 5.6#Con riferimento al potere di organizzazione, l'art. 5 del D. Lgs. n. 165/2001 prevede che#le amministrazioni pubbliche assumono ogni determinazione organizzativa al fine di assicurare l'attuazione dei principi di cui all'art. 2, c.1, D. Lgs. n. 165/2001 e la rispondenza al pubblico interesse dell'azione amministrativa#le amministrazioni pubbliche assumono ogni determinazione organizzativa al fine di assicurare l'attuazione dei principi di cui all'art. 2, c.1, D. Lgs. n. 165/2001#le amministrazioni pubbliche assumono ogni determinazione organizzativa al fine di non assicurare l'attuazione dei principi di cui all'art. 2, c.1, D. Lgs. n. 165/2001#le amministrazioni pubbliche assumono ogni determinazione organizzativa al fine di assicurare la rispondenza al pubblico interesse dell'azione amministrativa
DOMANDA 5.7#La responsabilità dirigenziale è#collegata alla verifica complessiva dei risultati#collegata all’inadempimento contrattuale a prescindere dai risultati#collegata a comportamenti illeciti di rilevanza penale#collegata a comportamenti illeciti di rilevanza civile
DOMANDA 5.8#Ai sensi dell'art. 2 del D. Lgs. n. 165/2001, ai dirigenti spetta#l'adozione degli atti e provvedimenti amministrativi, compresi tutti gli atti che impegnano l'amministrazione verso l'esterno#la definizione degli obiettivi e dei programmi da attuare, l'adozione degli altri atti rientranti nello svolgimento di tali funzioni, le richieste di pareri alle autorità amministrative indipendenti ed al Consiglio di Stato#la verifica della rispondenza dei risultati dell'attività amministrativa agli indirizzi ricevuti#la individuazione delle risorse umane, materiali ed economico-finanziarie da destinare alle diverse attività
DOMANDA 5.9#I dirigenti sono responsabili#in via esclusiva dell'attività amministrativa, della gestione e dei relativi risultati#in via sussidiaria dell'attività amministrativa, della gestione e dei relativi risultati#in via esclusiva dell'attività amministrativa e della gestione, ma non dei relativi risultati#dell'efficacia degli obiettivi e dei programmi
DOMANDA 5.10#L'assunzione nelle amministrazioni pubbliche avviene, ai sensi dell'art. 35 del D. Lgs. n. 165/2001, con contratto individuale di lavoro:#tramite procedure selettive volte all'accertamento della professionalità richiesta, che garantiscano in misura adeguata l'accesso dall'esterno, e mediante avviamento degli iscritti nelle liste di collocamento ai sensi della legislazione vigente per le qualifiche e profili per i quali è richiesto il solo requisito della scuola dell'obbligo, facendo salvi gli eventuali ulteriori requisiti per specifiche professionalità#tramite procedure selettive volte all'accertamento della professionalità richiesta, che non garantiscano in misura adeguata l'accesso dall'esterno, e mediante avviamento degli iscritti nelle liste di collocamento ai sensi della legislazione vigente per le qualifiche e profili per i quali è richiesto il solo requisito della scuola dell'obbligo, facendo salvi gli eventuali ulteriori requisiti per specifiche professionalità#tramite procedure selettive volte all'accertamento della professionalità richiesta, che garantiscano in misura adeguata l'accesso dall'esterno, e mediante avviamento degli iscritti nelle liste di collocamento ai sensi della legislazione vigente per le qualifiche e profili per i quali è richiesto il solo requisito della scuola dell'obbligo, senza considerare gli eventuali ulteriori requisiti per specifiche professionalità#tramite procedure selettive volte all'accertamento della professionalità richiesta, che garantiscano in misura adeguata l'accesso dall'esterno, e mediante avviamento degli iscritti nelle liste di collocamento ai sensi della legislazione vigente per le qualifiche e profili per i quali non è richiesto il requisito della scuola dell'obbligo, facendo salvi gli eventuali ulteriori requisiti per specifiche professionalità
DOMANDA 5.11#Il “percorso FIT” ai sensi dell’art.2 lett.b) del D.Lgs n.59/ 2017#è un percorso triennale di formazione iniziale, tirocinio e inserimento nella funzione docente differente fra posti comuni e posti di sostegno#è un percorso triennale di formazione iniziale, tirocinio e inserimento nella funzione docente unico per posti comuni e di sostegno#è un percorso annuale di formazione iniziale, tirocinio e inserimento nella funzione docente differente fra posti comuni e di sostegno, per la scuola sia primaria che secondaria#è un percorso biennale di formazione iniziale, tirocinio e inserimento nella funzione docente differente fra posti comuni e di sostegno
DOMANDA 5.12#Per selezionare i candidati all’accesso al percorso FIT l’art.3 del D.Lgs n.59/2017 prevede#un concorso per esami e titoli, nazionale su base regionale o, in caso di esiguo numero dei posti conferibili, interregionale#un concorso per esami e titoli, su base nazionale#un concorso per soli titoli, nazionale su base regionale#un concorso per soli titoli su base regionale
DOMANDA 5.13#2. Per selezionare i candidati all’accesso al percorso FIT, l’art.3 del D.Lgs n.59/2017, in caso di esiguo numero dei posti conferibili stabilisce che#il concorso viene bandito su base interregionale#il concorso viene bandito nel biennio successivo#il concorso viene bandito ugualmente sempre su base regionale#il concorso viene bandito ugualmente sempre ma su base solo nazionale
DOMANDA 5.14#Da chi è presieduta la commissione di valutazione finale per l’accesso ai ruoli del personale docente , ai sensi dell’art.13 del D.Lgs n.59/2017?#Dal dirigente scolastico della scuola ove il titolare di contratto FIT ha prestato servizio nel terzo anno del contratto medesimo#Da uno dei docenti delle università o delle istituzioni AFAM impegnati nei corsi di specializzazione#Dal tutor universitario o accademico#Dal tutor coordinatore dell’istituzione scolastica
DOMANDA 5.15#Per la valutazione del personale docente ed educativo, in periodo di formazione e di prova, il comma 118 dell’art.1 della L. n.107/2015 stabilisce che gli obiettivi, le modalità di valutazione del grado di raggiungimento degli stessi, le attività formative e i criteri sono individuati#con Decreto del Ministro dell’Istruzione, dell’Università e della Ricerca#con Decreto del Direttore dell’Ufficio Scolastico Regionale#con Determina del Dirigente Scolastico della scuola capofila della rete di Ambito#con Determina del Dirigente Scolastico della scuola presso cui presta servizio il docente
DOMANDA 5.16#La prova scritta del concorso pubblico per l'ammissione al corso di formazione dirigenziale e tirocinio consiste in:#cinque quesiti a risposta aperta e in due quesiti in lingua straniera#tre quesiti a risposta aperta e in due quesiti in lingua straniera#cinque quesiti a risposta chiusa e in due quesiti in lingua straniera#una trattazione di un caso sorteggiato dalla Commissione
DOMANDA 5.17#Il Dirigente scolastico presiede il Consiglio di Istituto?#no#sì, ma solo negli Istituti di Istruzione di secondo grado#sì, ma solo negli Istituti con una popolazione di alunni superiore alle 1200 unità#sì, ma solo se votato da almeno due terzi dei componenti
DOMANDA 5.18#La prova orale del concorso pubblico per l'ammissione al corso di formazione dirigenziale e tirocinio verifica anche la conoscenza della lingua prescelta dal candidato tra francese, inglese, tedesco e spagnolo al livello:#B2 del CEF#B1 del CEF#A2 del CEF#C1 del CEF
DOMANDA 5.19#ll corso di formazione dirigenziale comprende:#due mesi di formazione generale e quattro mesi di tirocinio integrati da sessioni di formazione erogabili anche a distanza#quattro mesi di formazione generale e due mesi di tirocinio integrati da sessioni di formazione erogabili anche a distanza#quattro mesi di formazione generale e quattro mesi di tirocinio integrati da sessioni di formazione erogabili anche a distanza#sei mesi di tirocinio integrati da sessioni di formazione erogabili anche a distanza
DOMANDA 5.20#Le Istituzioni scolastiche possono promuovere accordi di rete o aderire ad essi per il raggiungimento delle proprie finalità istituzionali?#sì#no#no, ad eccezione delle Istituzioni scolastiche situate in zone montane e nelle piccole isole#no, ad eccezione degli Istituti Comprensivi
DOMANDA 5.21#I principi cui devono conformarsi le procedure di reclutamento nelle pubbliche amministrazioni da quale articolo del D. Lgs. n. 165/2001 sono previsti?#art. 35#art. 35 bis#art. 37#art. 34
DOMANDA 5.22#Le determinazioni relative all'avvio di procedure di reclutamento sono adottate da ciascuna amministrazione o ente sulla base#del piano triennale del fabbisogno di personale#del piano annuale del fabbisogno di personale#del numero dei collocamenti a riposo del triennio precedente#delle vacanze della dotazione organica
DOMANDA 5.23#Le determinazioni per l'organizzazione degli uffici e le misure inerenti alla gestione dei rapporti di lavoro#sono assunte in via esclusiva dagli organi preposti alla gestione con la capacita' e i poteri del privato datore di lavoro#sono assunte in via esclusiva dagli organi preposti alla gestione con la capacita' e i poteri del pubblico datore di lavoro#sono assunte in via residuale dagli organi preposti alla gestione con la capacita' e i poteri del privato datore di lavoro#sono assunte in via esclusiva dagli organi di indirizzo con la capacita' e i poteri del privato datore di lavoro
DOMANDA 5.24#I rapporti individuali di lavoro alle dipendenze della pubblica Amministrazione sono regolati#contrattualmente#con contratti individuali, disposizioni di legge, regolamenti e atti amministrativi#con contratti collettivi, individuali, disposizioni di legge, regolamenti e atti amministrativi#con contratti collettivi
DOMANDA 5.25#Nel caso di nullità delle disposizioni contrattuali per violazione di norme imperative o dei limiti fissati alla contrattazione collettiva, l'art. 2, c. 3 bis del D. Lgs. n. 165/2001 stabilisce che#si applicano gli articoli 1339 e 1419, secondo comma, del codice civile#non si applicano gli articoli 1339 e 1419, secondo comma, del codice civile#si applicano gli articoli 1176 e 2236, primo comma, del codice civile#non si applicano gli articoli 1176 e 2236, primo comma, del codice civile
DOMANDA 5.26#Le amministrazioni pubbliche possono stipulare contratti di lavoro subordinato a tempo determinato, contratti di formazione e lavoro e contratti di somministrazione di lavoro a tempo determinato, nonché avvalersi delle forme contrattuali flessibili previste dal codice civile e dalle altre leggi sui rapporti di lavoro nell'impresa?#esclusivamente nei limiti e con le modalità in cui se ne preveda l'applicazione nelle amministrazioni pubbliche#senza limiti#no#sì, per comprovate esigenze di carattere permanente o eccezionale
DOMANDA 5.27#Non e' possibile ricorrere alla somministrazione di lavoro#per l'esercizio di funzioni direttive e dirigenziali#per l'esercizio di funzioni dirigenziali#per l'esercizio di funzioni direttive e apicali#per l'esercizio di funzioni direttive
DOMANDA 5.28#La violazione di disposizioni imperative riguardanti l'assunzione o l'impiego di lavoratori, da parte delle pubbliche amministrazioni#non può comportare la costituzione di rapporti di lavoro a tempo indeterminato con le medesime, ferma restando ogni responsabilità e sanzione. Il lavoratore interessato ha diritto al risarcimento del danno derivante dalla prestazione di lavoro in violazione di disposizioni imperative#non può comportare la costituzione di rapporti di lavoro a tempo indeterminato con le medesime, esclusa ogni responsabilità e sanzione. Il lavoratore interessato ha diritto al risarcimento del danno derivante dalla prestazione di lavoro in violazione di disposizioni imperative#non può comportare la costituzione di rapporti di lavoro a tempo indeterminato con le medesime, ferma restando ogni responsabilità e sanzione. Il lavoratore interessato non ha diritto al risarcimento del danno derivante dalla prestazione di lavoro in violazione di disposizioni imperative#non può comportare la costituzione di rapporti di lavoro a tempo indeterminato con le medesime, ferma restando ogni responsabilità e sanzione. Il lavoratore interessato ha diritto al risarcimento del danno derivante dalla prestazione di lavoro in violazione di norme dispositive
DOMANDA 5.29#Le cause di cessazione del rapporto di impiego previste dal Tit. VIII del D.P.R. n. 3/57 "Testo unico delle disposizioni concernenti lo statuto degli impiegati civili dello Stato" sono:#dimissioni, decadenza dall'impiego, dispensa dal servizio e collocamento a riposo#dimissioni, decadenza dall'impiego, dispensa dal servizio, licenziamento non disciplinare e collocamento a riposo#decadenza dall'impiego, dispensa dal servizio, licenziamento non disciplinare e collocamento a riposo#decadenza dall'impiego, dispensa dal servizio e collocamento a riposo
DOMANDA 5.30#Oltre che nel caso previsto dall'art. 63 del D.P.R. n. 3/57 (Testo unico delle disposizioni concernenti lo statuto degli impiegati civili dello Stato), l'impiegato incorre nella decadenza dall'impiego#quando, senza giustificato motivo, non assuma o non riassuma servizio entro il termine prefissogli, ovvero rimanga assente dall'ufficio per un periodo non inferiore a quindici giorni ove gli ordinamenti particolari delle singole amministrazioni non stabiliscano un termine più breve#quando accetti una missione o altro incarico da una autorità straniera con autorizzazione del ministro competente#quando non assuma o non riassuma servizio entro il termine prefissogli, ovvero rimanga assente dall'ufficio per un periodo non inferiore a quindici giorni ove gli ordinamenti particolari delle singole amministrazioni non stabiliscano un termine più breve#quando sia accertato che l'impiego fu conseguito mediante la produzione di documenti falsi o viziati da invalidità sanabile
DOMANDA 5.32#Le controversie in materia di procedure concorsuali per l'assunzione dei dipendenti delle pubbliche amministrazioni#restano devolute alla giurisdizione del giudice amministrativo#sono devolute al giudice ordinario, in funzione di giudice del lavoro, se successive all'entrata in vigore del D. Lgs. n. 80/98#restano devolute alla giurisdizione del giudice amministrativo, se insorte precedentemente all'entrata in vigore del D. Lgs. n. 80/98#sono devolute al giudice ordinario, in funzione di giudice del lavoro
DOMANDA 5.33#Le controversie relative a comportamenti antisindacali delle pubbliche amministrazioni ai sensi dell'articolo 28 della legge 20 maggio 1970, n. 300#sono devolute al giudice ordinario, in funzione di giudice del lavoro#sono devolute al giudice amministrativo#restano devolute alla giurisdizione del giudice amministrativo, se insorte precedentemente all'entrata in vigore del D. Lgs. n. 80/98#restano devolute al giudice ordinario, in funzione di giudice del lavoro, se insorte precedentemente all'entrata in vigore del D. Lgs. n. 80/98
DOMANDA 5.34#Ai sensi dell'art. 63 bis del D. Lgs. n. 165/2001, l'ARAN può intervenire nei giudizi innanzi al giudice ordinario, in funzione di giudice del lavoro#al fine di garantire la corretta interpretazione e l'uniforme applicazione dei contratti collettivi#al fine di garantire la corretta interpretazione e l'uniforme applicazione dei contratti integrativi#al fine di garantire la corretta applicazione dei contratti individuali#al fine di garantire la corretta interpretazione e l'uniforme applicazione delle disposizioni contrattuali sui trattamenti economici
DOMANDA 5.35#I lavoratori, ai sensi del'art. 20 della L. n. 300/70 (Norme sulla tutela della libertà e dignità dei lavoratori, della libertà sindacale e dell'attività sindacale, nei luoghi di lavoro e norme sul collocamento)#hanno diritto di riunirsi, nella unità produttiva in cui prestano la loro opera, fuori dell'orario di lavoro, nonché durante l'orario di lavoro, nei limiti di dieci ore annue, per le quali verrà corrisposta la normale retribuzione#hanno diritto di riunirsi, nella unità produttiva in cui prestano la loro opera, fuori dell'orario di lavoro, nonché durante l'orario di lavoro, nei limiti di venti ore annue, per le quali verrà corrisposta la normale retribuzione#hanno diritto di riunirsi, nella unità produttiva in cui prestano la loro opera, fuori dell'orario di lavoro, nonché durante l'orario di lavoro, nei limiti di dieci ore annue, per le quali non verrà corrisposta la normale retribuzione#hanno diritto di riunirsi, nella unità produttiva in cui prestano la loro opera , fuori dell'orario di lavoro, nei limiti di dieci ore annue, per le quali verrà corrisposta la normale retribuzione
DOMANDA 5.37#Le rappresentanze sindacali aziendali hanno diritto di affiggere#su appositi spazi, che il datore di lavoro ha l'obbligo di predisporre in luoghi accessibili a tutti i lavoratori all'interno dell'unità produttiva, pubblicazioni, testi e comunicati inerenti a materie di interesse sindacale e del lavoro#in luoghi accessibili a tutti i lavoratori all'interno dell'unità produttiva, pubblicazioni, testi e comunicati inerenti a materie di interesse sindacale e del lavoro#su appositi spazi, che il datore di lavoro ha la facoltà di predisporre in luoghi accessibili a tutti i lavoratori all'interno dell'unità produttiva, pubblicazioni, testi e comunicati inerenti a materie di interesse sindacale e del lavoro#su appositi spazi, che il datore di lavoro ha l'obbligo di predisporre in luoghi accessibili a tutti i lavoratori all'interno dell'unità produttiva, pubblicazioni, testi e comunicati
DOMANDA 5.39#Il datore di lavoro che non ottempera al decreto di cui al primo comma dell'art. 28 della L. n. 300/70, o alla sentenza pronunciata nel giudizio di opposizione è punito ai sensi dell'articolo#650 del codice penale#651 del codice penale#652 del codice penale#653 del codice penale
DOMANDA 5.40#L'autorità giudiziaria ordina la pubblicazione della sentenza penale di condanna relativa a condotta antisindacale nei modi stabiliti#dall'articolo 36 del codice penale#dalle disposizioni di attuazione del codice di procedura penale#dall'art. 36 del codice di procedura penale#dall'art. 37 del codice penale
DOMANDA 5.41#Ai sensi dell'art. 27 della L. n. 300/70, il datore di lavoro#nelle unità produttive con almeno 200 dipendenti pone permanentemente a disposizione delle rappresentanze sindacali aziendali, per l'esercizio delle loro funzioni, un idoneo locale comune all'interno della unità produttiva o nelle immediate vicinanze di essa#nelle unità produttive con almeno 100 dipendenti pone permanentemente a disposizione delle rappresentanze sindacali aziendali, per l'esercizio delle loro funzioni, un idoneo locale comune all'interno della unità produttiva o nelle immediate vicinanze di essa#nelle unità produttive con almeno 200 dipendenti è tenuto a porre permanentemente a disposizione delle rappresentanze sindacali aziendali, per l'esercizio delle loro funzioni, un idoneo locale comune esclusivamente all'interno della unità produttiva#nelle unità produttive con almeno 200 dipendenti pone a disposizione delle rappresentanze sindacali aziendali, per l'esercizio delle loro funzioni, un idoneo locale comune all'interno della unità produttiva o nelle immediate vicinanze di essa, previa richiesta scritta prima di ciascun utilizzo
DOMANDA 5.42#A seguito della sentenza della Corte costituzionale n. 231/2013, rappresentanze sindacali aziendali possono essere costituite ad iniziativa dei lavoratori in ogni unità produttiva, nell'ambito delle associazioni sindacali#pur non firmatarie dei contratti collettivi applicati nell'unità produttiva, che abbiano comunque partecipato alla negoziazione relativa agli stessi contratti quali rappresentanti dei lavoratori dell'azienda#che siano firmatarie di contratti collettivi di lavoro applicati nell'unità produttiva#pur non firmatarie dei contratti collettivi applicati nell'unità produttiva, anche se non abbiano partecipato alla negoziazione relativa agli stessi contratti quali rappresentanti dei lavoratori dell'azienda#che siano firmatarie di contratti integrativi applicati nell'unità produttiva
DOMANDA 5.43#Ai sensi dell'art. 21 della L. n. 300/70, il datore di lavoro deve consentire nell'ambito aziendale lo svolgimento#fuori dell'orario di lavoro, di referendum, sia generali che per categoria, su materie inerenti all'attività sindacale, indetti da tutte le rappresentanze sindacali aziendali tra i lavoratori#durante l'orario di lavoro, di referendum, sia generali che per categoria, su materie inerenti all'attività sindacale, indetti da tutte le rappresentanze sindacali aziendali tra i lavoratori#fuori dell'orario di lavoro, di referendum generali su materie inerenti all'attività sindacale, indetti da tutte le rappresentanze sindacali aziendali tra i lavoratori#fuori dell'orario di lavoro, di referendum, sia generali che per categoria, su materie inerenti all'attività sindacale, indetti dalla maggiore delle rappresentanze sindacali aziendali tra i lavoratori
DOMANDA 5.44#I contratti collettivi#sono stipulati secondo i criteri e le modalità previste nel titolo III del D. Lgs. n. 165/2001#sono stipulati secondo i criteri e le modalità previste nel titolo II del D. Lgs. n. 165/2001#sono stipulati secondo i criteri e le modalità previste nel titolo IV del D. Lgs. n. 165/2001#sono stipulati secondo i criteri e le modalità previste nel titolo V del D. Lgs. n. 165/2001
DOMANDA 5.45#In ciascuna amministrazione, ente o struttura amministrativa#ad iniziativa anche disgiunta delle organizzazioni sindacali di cui al comma 2 dell'art. 42 del D. Lgs. n. 165/2001, viene costituito un organismo di rappresentanza unitaria del personale mediante elezioni alle quali è garantita la partecipazione di tutti i lavoratori#ad iniziativa congiunta delle organizzazioni sindacali di cui al comma 2 dell'art. 42 del D. Lgs. n. 165/2001, viene costituito un organismo di rappresentanza unitaria del personale mediante elezioni alle quali è garantita la partecipazione di tutti i lavoratori#ad iniziativa anche disgiunta delle rappresentanze sindacali aziendali, viene costituito un organismo di rappresentanza unitaria del personale mediante elezioni alle quali è garantita la partecipazione di tutti i lavoratori#ad iniziativa del datore di lavoro pubblico, viene costituito un organismo di rappresentanza unitaria del personale mediante elezioni alle quali è garantita la partecipazione di tutti i lavoratori
DOMANDA 5.46#Nelle materie relative alle sanzioni disciplinari, alla valutazione delle prestazioni ai fini della corresponsione del trattamento accessorio, della mobilità#la contrattazione collettiva è consentita nei limiti previsti dalle norme di legge#la contrattazione collettiva può derogare alle norme di legge#le rappresentanze sindacali unitarie possono stipulare contratti decentrati#la contrattazione collettiva integrativa può derogare alla contrattazione collettiva nazionale
