DOMANDA 1.220#Cosa si intende per “fruizione a distanza”, ai sensi delle Linee Guida (5.3) adottate con D.I. 12 marzo 2015?#L’erogazione e la fruizione di unità di apprendimento (o parti di esse) in cui si articolano i percorsi di istruzione degli adulti mediante l’utilizzo delle nuove tecnologie dell’informazione e della comunicazione#L’erogazione e la fruizione di unità di apprendimento (o parti di esse) in cui si articolano i percorsi di istruzione degli adulti, indipendentemente dalla tipologia delle tecnologie e dei materiali utilizzati (ivi compresi libri, dispense e similari)#La fruizione per l’intero monte ore dei percorsi di istruzione degli adulti, ivi comprese le verifiche ai fini delle valutazioni periodiche e finali, da parte dell’adulto continuativamente impossibilitato a raggiungere la sede di svolgimento delle attività didattiche#Lo svolgimento unicamente di attività sincrone (conferenza online video) fra docente presente nelle sedi dei Centri provinciali per l’istruzione degli adulti e gruppi di livello presenti nelle aule AGORÀ (Ambiente interattivo per la Gestione dell’Offerta formativa Rivolta agli Adulti)
DOMANDA 1.221#Quanti sono gli indirizzi di studio dei nuovi percorsi dell’istruzione professionale previsti dall’art. 3, comma 1, del D.lgs. n. 61 del 13 aprile 2017?#11#4#10#8
DOMANDA 1.222#Come sono articolati i nuovi percorsi di istruzione professionale, ai sensi dell’art. 4, comma 1, del D.lgs. n. 61 del 13 aprile 2017?#In un biennio e in un successivo triennio#In un primo biennio, un secondo biennio e un quinto anno#In dieci periodi didattici quadrimestrali#In un primo triennio, volto al conseguimento della qualifica professionale, e in un successivo biennio
DOMANDA 1.223#Quante ore complessive comprende il biennio dei nuovi percorsi dell’istruzione professionale, ai sensi dell’art. 4, comma 2, del D.lgs. n. 61 del 13 aprile 2017?#2112#1188#924#264
DOMANDA 1.224#Quante sono le ore di attività e insegnamenti di istruzione generale nel biennio dei nuovi percorsi dell’istruzione professionale, ai sensi dell’art. 4, comma 2, del D.lgs. n. 61 del 13 aprile 2017?#1188#924#825#264
DOMANDA 1.225#Quante sono le ore di attività e insegnamenti di indirizzo nel biennio dei nuovi percorsi dell’istruzione professionale, ai sensi dell’art. 4, comma 2, del D.lgs. n. 61 del 13 aprile 2017?#924#1188#825#264
DOMANDA 1.226#Ai sensi dell'art. 21, comma 9, della legge 15 marzo 1997, n. 59, l’autonomia didattica è finalizzata al perseguimento degli obiettivi generali del sistema nazionale di istruzione, nel rispetto:#della libertà di insegnamento, della libertà di scelta educativa da parte delle famiglie e del diritto ad apprendere#delle direttive e degli obiettivi generali dell’Unione Europea in materia di libertà di insegnamento e di diritto ad apprendere#della libertà di insegnamento e, in subordine, della libertà di scelta educativa delle famiglie e del diritto ad apprendere#della libertà di scelta educativa delle famiglie e, in subordine, della libertà di insegnamento e del diritto ad apprendere
DOMANDA 1.227#Ai sensi dell'art. 21, comma 9, della legge 15 marzo 1997, n. 59, l’autonomia didattica si sostanzia:#nella scelta libera e programmata di metodologie, strumenti, organizzazione e tempi di insegnamento#nella scelta libera e programmata di metodologie, strumenti e obiettivi generali del sistema nazionale di istruzione#nella scelta libera e motivata dei tempi di insegnamento, in deroga agli obiettivi generali del sistema nazionale di istruzione#nella scelta libera e programmata di metodologie e strumenti, fatta eccezione per l'offerta di insegnamenti opzionali
DOMANDA 1.228#A chi è rivolta, a norma dell’art. 1, c. 12, della L. n. 107 del 13 luglio 2015, la programmazione delle attività formative contenuta nel piano triennale dell’offerta formativa?#Al personale docente e amministrativo, tecnico e ausiliario#Al solo personale docente in servizio a tempo indeterminato#Al personale docente e amministrativo, tecnico e ausiliario a tempo determinato#Al personale docente, amministrativo, tecnico e ausiliario e ai genitori
DOMANDA 1.229#Ai sensi dell’art. 15, c. 1, del D.P.R. n. 275 dell’8 marzo 1999, una delle funzioni in materia di personale, escluse dall’attribuzione alle istituzioni scolastiche, è la seguente:#la formazione delle graduatorie permanenti riferite ad ambiti territoriali più vasti di quelli della singola istituzione scolastica#le modalità diversificate di impiego dei docenti nelle varie classi e sezioni in funzione delle scelte metodologiche ed organizzative#gli adattamenti del calendario scolastico in relazione alle esigenze derivanti dal piano triennale dell'offerta formativa#gli insegnamenti in lingua straniera in attuazione di intese e accordi internazionali per l'arricchimento dell'offerta formativa
DOMANDA 1.230#A norma dell’art. 4, c. 2, del D.P.R. n. 275 dell’8 marzo 1999, tra le forme di flessibilità che le istituzioni scolastiche possono adottare vi è l’articolazione modulare di gruppi di alunni provenienti:#dalla stessa classe o da diverse classi o da diversi anni di corso#esclusivamente da classi dello stesso anno di corso#esclusivamente dalla stessa classe e da classi parallele#da diverse classi o da diverse scuole di ogni ordine e grado
DOMANDA 1.231#Gli assi culturali indicati nel documento tecnico, allegato al D.M. n. 139 del 22 agosto 2007, sono descritti in termini di:#competenze, abilità/capacità, conoscenze#conoscenze, abilità, discipline#competenze di base, discipline, conoscenze#competenze di base, saperi fondamentali, abilità
DOMANDA 1.232#A norma dell’art. 4, c. 2, del D.P.R. n. 275 dell’8 marzo 1999, le istituzioni scolastiche, nell’esercizio dell’autonomia didattica, regolano i tempi dell’insegnamento e dello svolgimento delle singole discipline e attività nel modo più adeguato:#al tipo di studi e ai ritmi di apprendimento degli alunni#alle iniziative eventualmente assunte dagli enti locali#al tipo di studi e ai relativi programmi di insegnamento#all'ampliamento e all'arricchimento dell'offerta formativa
DOMANDA 1.233#A norma dell’art. 8, c. 1, del D.P.R. n. 275 dell’8 marzo 1999, il Ministro definisce, tra l’altro, gli obiettivi generali del processo formativo, previo parere:#delle competenti Commissioni parlamentari#della Conferenza Stato-Regioni#del Consiglio dei Ministri#della Commissione europea
DOMANDA 1.235#Nel documento tecnico, allegato al D.M. n. 139 del 22 agosto 2007, i saperi e le competenze per l'assolvimento dell'obbligo di istruzione sono riferiti ai seguenti assi culturali:#dei linguaggi, matematico, scientifico-tecnologico, storico-sociale#dei linguaggi, fisico-matematico, tecnologico, storico-sociale#linguistico, digitale, scientifico-matematico, storico-culturale#storico-linguistico, digitale, matematico, scientifico-tecnologico
DOMANDA 1.237#Come sono articolati i saperi e le competenze di cui all’art. 2, comma 1, del D.M. n. 139 del 22 agosto 2007, descritti nell'allegato documento tecnico?#In conoscenze e abilità, con l’indicazione degli assi culturali di riferimento#In conoscenze e capacità, con riferimento ai diversi profili in uscita#In conoscenze, competenze di base e competenze chiave per l’apprendimento permanente#In conoscenze e competenze di base con l’indicazione degli obiettivi specifici di apprendimento
DOMANDA 1.238#A norma dell’art. 1, comma 1, del D.M. n. 139 del 22 agosto 2007, per almeno quanti anni è impartita l’istruzione obbligatoria?#Dieci#Dodici#Otto#Nove
DOMANDA 1.239#A cosa è finalizzato l’adempimento dell’obbligo di istruzione, ai sensi dell’art. 1, comma 2, del D.M. n. 139 del 22 agosto 2007?#Al conseguimento di un titolo di studio di scuola secondaria superiore o di una qualifica professionale di durata almeno triennale entro il 18° anno di età#Al raggiungimento degli obiettivi generali previsti dal sistema nazionale di istruzione e all’acquisizione delle competenze chiave europee#All’acquisizione delle competenze previste dai Profili in uscita di cui ai DD.PP.RR. n. 87, 88 e 89 del 2010#All’acquisizione delle competenze chiave europee e delle competenze previste dai Profili in uscita di cui ai DD.PP.RR. n. 87, 88 e 89 del 2010
DOMANDA 1.240#A norma dell’art. 8, c. 2, del D.P.R. n. 275 dell’8 marzo 1999, nel curricolo obbligatorio sono comprese discipline e attività liberamente scelte dalle istituzioni scolastiche?#Sì, nella quota riservata alle istituzioni scolastiche#Sì, ma soltanto nel secondo ciclo di istruzione#No, perché il curricolo obbligatorio comprende solo la quota definita a livello nazionale#No, non sono previste nel piano triennale dell'offerta formativa
DOMANDA 1.241#Chi sono, ai sensi dell’art. 5, comma 1, del D.lgs. n. 76 del 15 aprile 2005, i responsabili dell’adempimento del dovere di istruzione e formazione?#I genitori dei minori o coloro che a qualsiasi titolo ne facciano le veci#Il comune dove i minori ovvero i loro genitori hanno la residenza#Il dirigente dell’istituzione scolastica presso la quale lo studente è iscritto#Il responsabile dell’istituzione formativa presso la quale lo studente è iscritto
DOMANDA 1.243#Ai sensi dell’art. 1, c. 1, della L. n. 169 del 30 ottobre 2008, in quali aree sono comprese le attività finalizzate all’acquisizione delle conoscenze e delle competenze relative a «Cittadinanza e Costituzione»?#Storico-geografica e storico-sociale#Storico-letteraria e storico-sociale#Storico-geografica e storico-filosofica#Storico-filosofica e storico-letteraria
DOMANDA 1.244#Ai sensi dell’art. 1, c. 1, della L. n. 169 del 30 ottobre 2008, le azioni di sensibilizzazione e di formazione del personale finalizzate all’acquisizione delle conoscenze e delle competenze relative a «Cittadinanza e Costituzione» sono attivate:#nel primo e nel secondo ciclo di istruzione e iniziative analoghe sono avviate nella scuola dell’infanzia#nella scuola primaria e nella scuola secondaria esclusivamente di primo grado#esclusivamente nella scuola secondaria di secondo grado#solo nella scuola secondaria di secondo grado in cui è previsto l’insegnamento di «Diritto ed economia»
DOMANDA 1.246#Il diritto all’istruzione e alla formazione, ai sensi dell’art. 1, comma 3, del D.lgs. n. 76 del 15 aprile 2005, si realizza:#anche attraverso l’apprendistato#in via esclusiva nelle istituzioni scolastiche del secondo ciclo#in via esclusiva nel sistema educativo di istruzione e di formazione#solo nelle istituzioni scolastiche del primo ciclo
DOMANDA 1.247#Ai sensi dell’art. 1, comma 3, del D.lgs. n. 76 del 15 aprile 2005, il diritto all’istruzione e alla formazione è assicurato dalla Repubblica:#per almeno dodici anni o, comunque, sino al conseguimento di una qualifica di durata almeno triennale entro il diciottesimo anno di età#per almeno dieci anni o, comunque, fino al conseguimento di una qualifica almeno biennale entro il sedicesimo anno di età#per almeno dieci anni o, comunque, fino al completamento del primo biennio della scuola secondaria di secondo grado#fino al conseguimento del diploma finale di scuola secondaria di secondo grado o, comunque, per tredici anni
DOMANDA 1.248#Ai sensi dell’art. 1, comma 4, del D.lgs. n. 76 del 15 aprile 2005, i genitori, o chi ne fa le veci, possono provvedere privatamente o direttamente all’istruzione dei propri figli?#Sì, purché dimostrino di averne la capacità tecnica o economica e ne diano comunicazione alla competente autorità#Sì, purché accettino di avvalersi della capacità tecnica di una struttura formativa riconosciuta dalla competente autorità#No, perché il diritto all’istruzione e alla formazione si realizza esclusivamente nelle istituzioni scolastiche del primo e del secondo ciclo#No, perché il diritto all’istruzione e alla formazione si realizza esclusivamente nelle istituzioni scolastiche e formative della Repubblica
DOMANDA 1.250#Le scuole secondarie di secondo grado, ai sensi dell’art. 1, comma 28, della legge n. 107 del 13 luglio 2015, introducono insegnamenti opzionali anche utilizzando la quota di autonomia e gli spazi di flessibilità:#nel secondo biennio e nell'ultimo anno#nel primo e nel secondo biennio#soltanto nell'ultimo anno#nel primo e nel secondo biennio e nell'ultimo anno
DOMANDA 1.251#Ai sensi dell’art. 1, comma 22, della legge n. 107 del 13 luglio 2015, le istituzioni scolastiche e gli enti locali possono promuovere, nei periodi di sospensione dell’attività didattica, attività educative, ricreative, culturali, artistiche e sportive, anche in collaborazione con:#le famiglie interessate e le realtà associative del territorio e del terzo settore#il consiglio di istituto e la consulta provinciale degli studenti#le famiglie interessate e la consulta provinciale degli studenti#le reti di istituti, statali o paritari, esistenti nel territorio
DOMANDA 1.252#Ai sensi dell’art. 9, c. 2, del D.P.R. n. 89 del 15 marzo 2010, l’opzione economico-sociale del Liceo delle scienze umane può essere attivata:#nell'ambito della programmazione regionale dell'offerta formativa#nell'ambito del piano triennale dell'offerta formativa#nella quota del curricolo riservata alle istituzioni scolastiche#nella realizzazione di percorsi formativi integrati facoltativi
DOMANDA 1.253#A norma dell’art. 4, c. 1, del D.P.R. n. 275 dell’8 marzo 1999, nell’esercizio dell’autonomia didattica le istituzioni scolastiche:#concretizzano gli obiettivi nazionali in percorsi formativi funzionali alla realizzazione del diritto ad apprendere#adeguano gli obiettivi del piano triennale dell’offerta formativa ai percorsi formativi nazionali#concretizzano gli obiettivi nazionali in percorsi formativi funzionali alle esigenze degli enti locali#adeguano prioritariamente gli obiettivi del piano triennale dell’offerta formativa alle esigenze del territorio e delle famiglie
DOMANDA 1.254#Ai sensi dell’art. 10, c. 7, del D.P.R. n. 89 del 15 marzo 2010, nei licei le attività e gli insegnamenti relativi a «Cittadinanza e Costituzione» si sviluppano con riferimento a quale insegnamento?#«Diritto ed economia» o, in mancanza di quest'ultimo, «Storia e Geografia» e «Storia»#«Diritto ed economia o, in mancanza di quest'ultimo, «Lingua e letteratura italiana»#«Filosofia» o, in mancanza di quest'ultimo, «Storia e Geografia»#«Scienze umane» o, in mancanza di quest'ultimo, «Storia»
DOMANDA 1.256#A norma dell’art. 8, comma 1, lettera g), del D.P.R. n. 275 dell’8 marzo 1999, il Ministro definisce gli indirizzi generali circa:#la valutazione degli alunni, il riconoscimento dei crediti e dei debiti formativi#la valutazione del sistema nazionale di istruzione#la valutazione esterna delle istituzioni scolastiche autonome#l'autovalutazione delle istituzioni scolastiche autonome
DOMANDA 1.257#A norma dell’art. 8, comma 1, lettera c), del D.P.R. n. 275 dell’8 marzo 1999, il Ministro definisce:#le discipline e le attività costituenti la quota nazionale dei curricoli e il relativo monte ore annuale#la personalizzazione del curricolo della singola istituzione scolastica autonoma#l’orario obbligatorio annuale dei curricoli con esclusione della quota riservata alle istituzioni scolastiche#gli ampliamenti dell'offerta formativa che tengano conto delle esigenze locali
DOMANDA 1.258#A norma dell’art. 4, comma 2, lettera e), del D.P.R. n. 275 dell’8 marzo 1999, tra le forme di flessibilità che le istituzioni scolastiche possono adottare vi è:#l’aggregazione delle discipline in aree e ambiti disciplinari#la definizione dell'orario obbligatorio annuale complessivo dei curricoli#la definizione degli obiettivi specifici di apprendimento#la definizione degli indirizzi generali circa la valutazione degli alunni
DOMANDA 1.259#A norma dell’art. 1, c. 13, della L. n. 107 del 13 luglio 2015, l'ufficio scolastico regionale:#verifica che il piano triennale dell'offerta formativa rispetti il limite dell'organico assegnato a ciascuna istituzione scolastica#assicura piena trasparenza e pubblicità al piano triennale dell'offerta formativa predisposto dalle istituzioni scolastiche#verifica che al piano triennale dell'offerta formativa predisposto dalle istituzioni scolastiche sia assicurata piena trasparenza e pubblicità#approva il piano dell’offerta formativa predisposto dalle istituzioni scolastiche e lo trasmette al Ministero dell’istruzione, dell’università e della ricerca
DOMANDA 1.261#A norma dell'art. 21, comma 10, della legge 15 marzo 1997, n. 59, le istituzioni scolastiche realizzano ampliamenti dell’offerta formativa:#sia singolarmente che in forme consorziate#soltanto singolarmente#in forme consorziate e non singolarmente#solo con l'autorizzazione del MIUR
DOMANDA 1.263#Secondo l'art. 21, comma 12, della legge 15 marzo 1997, n. 59, le università e le istituzioni scolastiche possono stipulare convenzioni allo scopo di:#favorire attività di aggiornamento, di ricerca e di orientamento scolastico e universitario#realizzare attività di valutazione del sistema nazionale di istruzione#ottimizzare le risorse umane, finanziarie e tecnologiche#favorire la realizzazione di curricoli verticali
DOMANDA 1.267#A norma dell’art. 3, c. 4, del D.lgs. n. 262 del 29 dicembre 2007, al fine di garantire validità ad ogni valutazione di risultati avanzati ed assicurare la credibilità delle azioni intraprese, ogni iniziativa di riconoscimento delle eccellenze degli studenti nei percorsi di istruzione deve avere a riferimento:#un'autorità scientifica significativa#il Ministero dell’istruzione, dell’università e della ricerca#il consiglio di classe e il collegio dei docenti#un apposito comitato tecnico nazionale
DOMANDA 1.270#A norma dell’art. 7, c. 2, del D.P.R. n. 275 dell’8 marzo 1999, le istituzioni scolastiche possono promuovere accordi di rete che abbiano, tra l'altro, a oggetto:#attività didattiche, di ricerca, sperimentazione e sviluppo, di formazione e aggiornamento, di amministrazione e contabilità, di acquisto di beni e servizi#attività didattiche, di ricerca, sperimentazione e sviluppo, di formazione e aggiornamento, di amministrazione e contabilità, con esclusione di quelle di acquisto di beni e servizi#attività didattiche, di ricerca, sperimentazione e sviluppo, di formazione e aggiornamento, con esclusione di quelle di amministrazione e contabilità#attività didattiche, di formazione e aggiornamento, di amministrazione e contabilità, con esclusione di quelle di ricerca, sperimentazione e sviluppo
DOMANDA 1.271#Come è realizzato il percorso FIT, ai sensi del D.lgs. 13 aprile 2017, n. 59, art. 2, comma 3?#Attraverso una collaborazione strutturata e paritetica fra scuola, università e istituzioni dell'alta formazione artistica, musicale e coreutica con una chiara distinzione dei rispettivi ruoli e competenze#Attraverso una collaborazione strutturata tra Governo, Istituzioni scolastiche e Uffici Scolastici Regionali con una chiara distinzione dei rispettivi ruoli e competenze#Attraverso una collaborazione strutturata ma non paritetica fra scuola e istituzioni dell'alta formazione artistica, musicale e coreutica con una chiara distinzione dei rispettivi ruoli e competenze#Attraverso una collaborazione continua ed equivalente fra scuola, università e Uffici Scolastici Regionali con le necessarie distinzioni dei rispettivi ruoli e competenze
DOMANDA 1.272#Il concorso nazionale per esami e titoli per selezionare i candidati all'accesso al percorso FIT, ai sensi del D.lgs. 13 aprile 2017, n. 59, art. 3, comma 1, è indetto con:#decreto del Ministero dell'istruzione, dell'università e della ricerca#decreto del Presidente del Consiglio dei ministri#decreto del Presidente della Repubblica#decreto del Ministero dell'economia e delle finanze
DOMANDA 1.273#Il concorso nazionale per esami e titoli per selezionare i candidati all'accesso al percorso FIT, ai sensi del D.lgs. 13 aprile 2017, n. 59, art. 3, comma 2, è bandito con cadenza:#biennale#triennale#quadriennale#annuale
DOMANDA 1.274#Per accedere al percorso FIT, ai sensi del D.lgs. 13 aprile 2017, n. 59, art. 3, comma 5, ciascun candidato può concorrere:#in una sola regione, per le tipologie di posto messe a concorso nella stessa#al massimo in due regioni, per le tipologie di posto messe a concorso nelle stesse#al massimo in tre regioni, per le tipologie di posto messe a concorso nelle stesse#al massimo in quattro regioni, per le tipologie di posto messe a concorso nelle stesse
DOMANDA 1.275#Ai sensi del D.lgs. 13 aprile 2017, n. 59, art. 5, comma 1, quali sono i requisiti di accesso al concorso per il percorso FIT?#il possesso congiunto di laurea magistrale o a ciclo unico, oppure diploma di II livello AFAM, oppure titolo equipollente o equiparato, coerente con le classi di concorso vigenti alla data di indizione del concorso e di 24 crediti formativi universitari o accademici, acquisiti nelle discipline antropo-psico-pedagogiche e nelle metodologie e tecnologie didattiche#il possesso di laurea magistrale o a ciclo unico oppure diploma di II livello AFAM, oppure titolo equipollente o equiparato, coerente con le classi di concorso vigenti alla data di indizione del concorso. Tale requisito può essere sostituito da 24 crediti formativi universitari o accademici certificati, acquisiti nelle discipline antropo-psico-pedagogiche e nelle metodologie e tecnologie didattiche#il possesso congiunto di laurea triennale oppure diploma di II livello AFAM, oppure titolo equipollente o equiparato, coerente con le classi di concorso vigenti alla data di indizione del concorso e di 24 crediti formativi universitari o accademici, acquisiti nelle discipline antropo-psico-pedagogiche e nelle metodologie e tecnologie didattiche#il possesso congiunto di laurea triennale o a ciclo unico, oppure diploma di II livello AFAM, oppure titolo equipollente o equiparato, coerente con le classi di concorso vigenti alla data di indizione del concorso e di 28 crediti formativi universitari o accademici, acquisiti nelle discipline antropo-psico-pedagogiche e nelle metodologie e tecnologie didattiche
DOMANDA 1.276#Quante sono le prove di esame del concorso per accedere al percorso FIT, ai sensi del D.lgs. 13 aprile 2017, n. 59, art. 6, comma 1?#Tre, delle quali due, a carattere nazionale, sono scritte e una orale#Due, delle quali una scritta a carattere nazionale e l’altra orale#Quattro, delle quali due, a carattere nazionale, sono scritte e due orali#Cinque, delle quali due, a carattere nazionale, sono scritte e tre orali
DOMANDA 1.277#I vincitori del concorso per accedere al percorso FIT che, alla data del 30 giugno, risultano presenti in posizione utile in più graduatorie, ai sensi del D.lgs. 13 aprile 2017, n. 59, art. 7, comma 4, sono tenuti a optare per:#una sola di esse#al massimo due di esse#al massimo tre di esse#quelle per le quali hanno requisiti più recenti
DOMANDA 1.278#Ai sensi del D.lgs. 13 aprile 2017, n. 59, art. 7, comma 4, i vincitori del concorso per accedere al percorso FIT che, alla data del 30 giugno, risultando presenti in posizione utile in più graduatorie, non effettuano alcuna opzione:#sono cancellati da tutte le graduatorie già pubblicate alla data del 30 giugno#sono assegnati dall’Ufficio Scolastico Regionale competente alla graduatoria più breve tra quelle già pubblicate alla data del 30 giugno#restano inseriti in tutte le graduatorie già pubblicate alla data del 30 giugno per i tre anni successivi#restano inseriti nelle graduatorie alla data del 30 giugno per i due anni successivi
DOMANDA 1.279#Ai sensi del D.lgs. 13 aprile 2017, n. 59, art. 8, comma 1, i vincitori del concorso per accedere al percorso FIT sottoscrivono un contratto:#triennale retribuito di formazione iniziale, tirocinio e inserimento#annuale non retribuito di formazione iniziale, tirocinio e inserimento#triennale non retribuito di formazione iniziale, tirocinio e inserimento#biennale retribuito di formazione iniziale, tirocinio e inserimento
DOMANDA 1.280#Ai sensi del D.lgs. 13 aprile 2017, n. 59, art. 8, comma 5, lettera c), il contratto FIT è sospeso nel caso di impedimenti temporanei per un periodo massimo complessivo di:#un anno#diciotto mesi#sei mesi#tre mesi
DOMANDA 1.281#Ai sensi del D.lgs. 13 aprile 2017, n. 59, art. 8, comma 5, lettera d), al termine del primo anno, il titolare di contratto FIT su posto comune è tenuto a:#conseguire il diploma di specializzazione per l’insegnamento secondario#completare la propria preparazione professionale con ulteriori attività formative nel campo della didattica dell'inclusione scolastica#completare la propria preparazione professionale con ulteriori attività di studio#conseguire il diploma di formatore indiretto di tirocinio
DOMANDA 1.282#Ai sensi del D.lgs. 13 aprile 2017, n. 59, art. 10, comma 1, il contratto FIT è confermato per il terzo anno a condizione che il titolare abbia:#superato con esito positivo la valutazione intermedia alla fine del secondo anno#ottenuto giudizi positivi dal Dirigente scolastico della scuola interessata#svolto almeno 45 giorni di supplenza#svolto almeno 60 giorni di supplenza
DOMANDA 1.283#Ai sensi del D.lgs. 13 aprile 2017, n. 59, art. 8, comma 3, il terzo anno del contratto FIT prevede:#le medesime condizioni normative ed economiche del contratto di supplenza annuale#le condizioni normative definite in sede di contrattazione collettiva nazionale#le condizioni normative definite dal Dirigente Scolastico#le condizioni normative definite dal Dirigente Scolastico sentiti i Consigli di circolo o d'istituto
