DOMANDA 1.1#Ai sensi dell’art. 2, comma 1, del D.P.R. n. 89/2009, la scuola dell’infanzia accoglie bambini di età compresa:#tra i tre e i cinque anni compiuti entro il 31 dicembre dell’anno scolastico di riferimento#tra i tre e i sei anni compiuti entro il 31 dicembre dell’anno scolastico di riferimento#tra i tre e i cinque anni compiuti entro il 30 aprile dell’anno scolastico di riferimento#tra i tre e i cinque anni compiuti entro il 31 agosto dell’anno scolastico di riferimento
DOMANDA 1.2#Ai sensi dell’art. 2, comma 2, del D.P.R. n. 89/2009, su richiesta delle famiglie sono iscritti alla scuola dell’infanzia le bambine e i bambini che compiono tre anni di età entro il:#30 aprile dell’anno scolastico di riferimento#31 dicembre dell’anno scolastico di riferimento#31 agosto dell’anno scolastico di riferimento#30 giugno dell’anno scolastico di riferimento
DOMANDA 1.3#Ai sensi dell’art. 2, comma 5, del D.P.R. n. 89/2009, l’orario di funzionamento della scuola dell’infanzia è stabilito in:#40 ore settimanali, con possibilità di estensione fino a 50 ore#40 ore settimanali, senza alcuna possibilità di estensione#36 ore settimanali, con possibilità di estensione fino a 40 ore#36 ore settimanali, senza alcuna possibilità di estensione
DOMANDA 1.4#Ai sensi dell’art. 2, comma 5, del D.P.R. n. 89/2009, nella scuola dell’infanzia permane la possibilità di chiedere, da parte delle famiglie, un tempo scuola ridotto, limitato alla sola fascia del mattino, per complessive:#25 ore settimanali#24 ore settimanali#27 ore settimanali#30 ore settimanali
DOMANDA 1.5#Ai sensi dell’art. 1, comma 1, del D.lgs. n. 59/2004, la scuola dell’infanzia contribuisce alla formazione integrale delle bambine e dei bambini, anche promuovendo il plurilinguismo attraverso l'acquisizione dei primi elementi:#della lingua inglese#di una lingua comunitaria#di due lingue comunitarie#di almeno due lingue comunitarie
DOMANDA 1.6#Gli allegati B, C, D, E, F, G al D.P.R. n. 89/2010 contengono i piani di studio dei percorsi liceali. Secondo quanto stabilito in tali allegati, quali licei hanno nel piano degli studi i Laboratori?#Liceo musicale e coreutico e Liceo artistico#Liceo scientifico e Liceo classico#Liceo artistico, Liceo scientifico e Liceo scientifico a indirizzo sportivo#Liceo linguistico e Liceo scientifico
DOMANDA 1.7#A norma dell’articolo 7, comma 2, del D.P.R. n. 89/2010, l’iscrizione a quale percorso liceale è subordinata al superamento di una prova preordinata alla verifica del possesso di specifiche competenze?#Liceo musicale e coreutico#Liceo artistico#Liceo linguistico#Liceo scientifico a indirizzo sportivo
DOMANDA 1.8#A norma dell’articolo 4, comma 7, del D.P.R. n. 89/2010, in quale percorso liceale il potenziamento e l’articolazione dell’offerta formativa possono essere assicurati mediante specifiche intese con le Regioni, con particolare riferimento alle attività laboratoriali ed alle interazioni con il mondo del lavoro?#Liceo artistico#Liceo classico#Liceo linguistico#Liceo scientifico
DOMANDA 1.9#L’articolo 10, comma 1, lettera c), del D.P.R. n. 89/2010, in relazione alla quota dei piani di studio rimessa alle singole istituzioni scolastiche, fa espressamente divieto di:#sopprimere le discipline previste nell’ultimo anno di corso#sopprimere le discipline previste nel secondo biennio e nell’ultimo anno di corso#ridurre le discipline previste nell’ultimo anno di corso#sopprimere le discipline oggetto della seconda prova all’Esame di Stato
DOMANDA 1.10#L’Allegato A al D.P.R. n. 89/2010 contiene il Profilo educativo, culturale e professionale dei Licei, nel quale si prevede che: “La cultura liceale consente di approfondire e sviluppare conoscenze e abilità, maturare competenze e acquisire strumenti”; in quante e quali aree?#In 5 aree: metodologica; logico argomentativa; linguistica e comunicativa; storico-umanistica; scientifica, matematica e tecnologica#In 5 aree: linguistico-letteraria; matematica; scientifica; tecnica; artistica#In 4 aree: linguistico-letteraria; scientifico-matematica; artistico-espressiva; storico-sociale#In 4 aree: logico argomentativa; linguistica e comunicativa; storico-umanistica; scientifica, matematica e tecnologica
DOMANDA 1.11#Secondo l’art. 117 della Cost., lo Stato ha legislazione esclusiva in materia di:#norme generali sull'istruzione#programmazione dell’offerta formativa#piani di dimensionamento della rete scolastica#norme relative alla formazione professionale
DOMANDA 1.12#Secondo l’art. 117 della Cost., costituisce materia di legislazione concorrente:#l’istruzione, salva l'autonomia delle istituzioni scolastiche e con esclusione dell'istruzione e della formazione professionale#i livelli essenziali delle prestazioni per quanto concerne l’autonomia scolastica, l’istruzione e la formazione professionale#i livelli essenziali delle prestazioni del secondo ciclo del sistema educativo di istruzione e formazione#le norme generali sul sistema educativo di istruzione e formazione, con particolare riferimento all’autonomia scolastica
DOMANDA 1.13#Il numero dei Dipartimenti in cui si articola il Ministero dell’istruzione, dell’università e della ricerca, a livello centrale, secondo l’art. 2, comma 1, del D.P.C.M. n. 98 dell'11 febbraio 2014, è:#tre#quattro#due#otto
DOMANDA 1.14#Ai sensi dell’art. 1, comma 2, del D.lgs. n. 226/2005:#lo Stato garantisce i livelli essenziali delle prestazioni del secondo ciclo del sistema educativo di istruzione e formazione#le Regioni garantiscono i livelli essenziali delle prestazioni del secondo ciclo del sistema educativo di istruzione e formazione#lo Stato garantisce i livelli essenziali delle prestazioni del primo ciclo del sistema educativo di istruzione#lo Stato garantisce il diritto all’istruzione e alla formazione professionale a tutti i cittadini italiani
DOMANDA 1.15#La Direzione Generale per gli ordinamenti scolastici e la valutazione del sistema nazionale di istruzione, ai sensi dell’art. 5, comma 5, lettera e), del D.P.C.M. n. 98 dell’11 febbraio 2014, svolge le funzioni e i compiti di spettanza del Ministero nel seguente ambito:#ordinamento dell'istruzione degli adulti nell'ambito dell'apprendimento permanente#ordinamento dell'istruzione degli alunni stranieri#indirizzo, vigilanza e coordinamento dei progetti internazionali#supporto alla redazione del Programma nazionale per la ricerca
DOMANDA 1.16#In quanti periodi didattici sono articolati i percorsi di istruzione per gli adulti di primo livello, ai sensi del D.P.R. n. 263 del 29 ottobre 2012, art. 4, comma 2?#Due#Tre#Quattro#Nessuno
DOMANDA 1.17#In quanti periodi didattici sono articolati i percorsi di istruzione per gli adulti di secondo livello, ai sensi del D.P.R. n. 263 del 29 ottobre 2012, art. 4, comma 3?#Tre#Due#Quattro#Nessuno
DOMANDA 1.18#Quante ore sono destinate all’asse dei linguaggi, nel quadro orario dei percorsi di istruzione degli adulti di primo livello relativi al primo periodo didattico, ai sensi delle Linee Guida adottate con D.I. 12 marzo 2015 (Allegato A.3, tabella 1)?#198#330#165#264
DOMANDA 1.19#Quante ore sono destinate all’asse matematico, nel quadro orario dei percorsi di istruzione degli adulti di primo livello relativi al primo periodo didattico, ai sensi delle Linee Guida adottate con D.I. 12 marzo 2015 (Allegato A.3, tabella 1)?#66#99#198#165
DOMANDA 1.20#Quante ore sono destinate all’asse scientifico-tecnologico, nel quadro orario dei percorsi di istruzione degli adulti di primo livello relativi al primo periodo didattico, ai sensi delle Linee Guida adottate con D.I. 12 marzo 2015 (Allegato A.3, tabella 1)?#66#99#198#165
DOMANDA 1.21#Ai sensi dell'art. 21, comma 1, della legge 15 marzo 1997, n. 59, l’autonomia delle istituzioni scolastiche si inserisce:#nel processo di riorganizzazione dell’intero sistema formativo#all’interno di una serie di misure finalizzate alla tutela e alla promozione dei beni culturali#all’interno di una serie di compiti conferiti in via sperimentale alle regioni e agli enti locali#nel processo di valorizzazione degli istituti tecnici e professionali e degli istituti d’arte
DOMANDA 1.22#Ai sensi dell'art. 21, comma 1, della legge 15 marzo 1997, n. 59, l'autonomia delle istituzioni scolastiche si realizza:#fermi restando i livelli unitari e nazionali di fruizione del diritto allo studio#in via esclusiva negli istituti tecnici e professionali e negli istituti d’arte#nel trasferimento di tutte le funzioni dell’amministrazione centrale in materia di istruzione#soltanto nelle misure per l’attuazione dell’obbligo scolastico e formativo
DOMANDA 1.23#Ai sensi dell'art. 21, comma 8, della legge 15 marzo 1997, n. 59, l'autonomia organizzativa è finalizzata alla:#realizzazione della flessibilità, della diversificazione, dell’efficienza e dell’efficacia del servizio scolastico#flessibilità del servizio scolastico, compreso il superamento del numero di giorni di attività didattica annuale previsti a livello nazionale#flessibilità e al miglior utilizzo delle risorse, anche in deroga ai complessivi obblighi annuali di servizio dei docenti#realizzazione della flessibilità in materia di unità oraria della lezione, ferma restando la distribuzione in non meno di sei giorni alla settimana dell’attività didattica
DOMANDA 1.24#Ai sensi dell'art. 21, comma 9, della legge 15 marzo 1997, n. 59, l'autonomia didattica è finalizzata al perseguimento:#degli obiettivi generali del sistema nazionale di istruzione#degli obiettivi generali stabiliti da regioni ed enti locali#della sostenibilità finanziaria del sistema nazionale di istruzione#degli obiettivi generali del sistema nazionale di formazione del personale
DOMANDA 1.25#Ai sensi dell'art. 21, comma 7, della legge 15 marzo 1997, n. 59, le istituzioni scolastiche dotate di personalità giuridica e autonomia:#hanno autonomia organizzativa e didattica, nel rispetto degli obiettivi del sistema nazionale di istruzione e degli standard di livello nazionale#hanno autonomia organizzativa e didattica e definiscono in modo autonomo gli obiettivi generali e gli standard del sistema di istruzione#hanno un grado differenziato di autonomia didattica e organizzativa in base ai propri requisiti dimensionali#hanno un grado diverso di autonomia didattica e organizzativa in base agli obiettivi e agli standard di livello regionale
DOMANDA 1.26#Ai sensi del D.lgs. 13 aprile 2017, n. 59, art. 12, comma 1, nell'ambito della formazione iniziale finalizzata al reclutamento dei docenti nella scuola secondaria:#il tirocinio, diretto e indiretto, è parte integrante e obbligatoria del percorso FIT#il tirocinio diretto è parte integrante e obbligatoria, mentre quello indiretto è regolamentato dal dirigente scolastico che può renderlo facoltativo in base alle esigenze scolastiche#il tirocinio, diretto e indiretto, è regolamentato dal dirigente scolastico che può renderlo facoltativo in base alle esigenze scolastiche#il tirocinio, diretto e indiretto, è parte integrante ma non obbligatoria del percorso FIT
DOMANDA 1.27#Ai sensi del D.lgs. 13 aprile 2017, n. 59, art. 13, comma 2, al termine del percorso FIT, la commissione di valutazione finale per l’accesso ai ruoli di docente nella scuola secondaria è presieduta dal dirigente scolastico della scuola ove il titolare di contratto FIT:#ha prestato servizio nel terzo anno del contratto medesimo#ha prestato servizio nei primi due anni del contratto medesimo#ha prestato servizio nel primo anno del contratto medesimo#ha prestato servizio nel secondo anno del contratto medesimo
DOMANDA 1.28#Ai sensi del D.lgs. 13 aprile 2017, n. 59, art. 2, comma 1, il sistema di formazione iniziale e accesso nei ruoli di docente nella scuola secondaria è articolato in:#un concorso pubblico nazionale, un successivo percorso triennale di formazione iniziale, tirocinio e inserimento nella funzione docente, una procedura di accesso ai ruoli a tempo indeterminato#un concorso pubblico provinciale, un successivo percorso triennale di formazione iniziale, tirocinio e inserimento nella funzione docente, una procedura di accesso ai ruoli a tempo determinato#un concorso pubblico nazionale, un successivo percorso biennale di formazione iniziale, tirocinio e inserimento nella funzione docente, una procedura di accesso ai ruoli a tempo determinato#un concorso pubblico provinciale, un successivo percorso biennale di formazione iniziale, tirocinio e inserimento nella funzione docente, una procedura di accesso ai ruoli a tempo indeterminato
DOMANDA 1.29#Ai sensi del D.lgs. 13 aprile 2017, n. 59, art. 1, comma 2, il sistema unitario e coordinato di formazione iniziale e accesso nei ruoli dei docenti viene introdotto al fine di:#realizzare la valorizzazione sociale e culturale della professione#eliminare il precariato nella scuola italiana#garantire una formazione retribuita al pari degli standard internazionali#migliorare la formazione dei docenti e garantire livelli più elevati di preparazione dei discenti
DOMANDA 1.30#Ai sensi del D.lgs. 13 aprile 2017, n. 59, art. 1, comma 3, il sistema unitario e coordinato di formazione iniziale e accesso nei ruoli dei docenti costituisce:#un percorso verticale unitario di formazione dei docenti della scuola secondaria#un percorso orizzontale unitario di formazione dei docenti della scuola secondaria#un percorso verticale unitario di formazione dei docenti della scuola primaria e secondaria#un percorso orizzontale unitario di formazione dei docenti della scuola primaria e secondaria
DOMANDA 1.31#Ai sensi dell'art. 283, comma 1, del D.lgs. n. 297/1994, a quali soggetti possono essere assegnati direttamente i fondi per la realizzazione di attività di aggiornamento destinate al personale?#Alle istituzioni scolastiche di ogni ordine e grado#Ai provveditorati agli studi#Agli IRRSAE#Alla Biblioteca di Documentazione Pedagogica
DOMANDA 1.32#Ai sensi dell'art. 15, comma 1, del D.lgs. n. 64/2017, le modalità della formazione propedeutica alla destinazione all'estero e delle attività di formazione in servizio del personale da destinare all'estero sono stabilite con decreto del Ministero dell'istruzione, dell'università e della ricerca, adottato di concerto con:#il Ministero degli affari esteri e della cooperazione internazionale#le Ambasciate#i Consolati#l'INVALSI
DOMANDA 1.33#Quale norma ha istituito gli organi collegiali della scuola?#D.P.R. n. 416/1974#D.P.R. n. 275/1999#L. n. 59/1997#D.P.R. n. 419/1974
DOMANDA 1.35#Ai sensi dell'art. 285, comma 3, del D.lgs. n. 297/1994, quali funzioni potevano svolgere gli istituti regionali di ricerca, sperimentazione e aggiornamento educativi (IRRSAE)?#Organizzazione di iniziative di aggiornamento e collaborazione tecnico-scientifica nelle scuole#Raccolta, elaborazione e diffusione della documentazione pedagogico-didattica italiana e straniera#Conduzione di studi e ricerche sugli ordinamenti scolastici di altri Paesi#Studi e ricerche a livello comparativo europeo sui problemi dell'apprendimento e della relativa valutazione
DOMANDA 1.36#Ai sensi dell’art. 10, c. 3, lett. a), del D.lgs. 16 aprile 1994, n. 297, il Regolamento interno del circolo o dell’istituto viene deliberato:#dal consiglio di circolo o d’istituto#dai consigli di classe#dal consiglio d’ istituto e dai consigli di classe#dal collegio dei docenti su iniziativa del dirigente scolastico
DOMANDA 1.37#Ai sensi dell’art. 4, c. 8, del D.P.R. 10 ottobre 1996, n. 567, per la realizzazione delle iniziative complementari e delle attività integrative nelle istituzioni scolastiche il comitato studentesco può anche realizzare attività di autofinanziamento, consistenti nella promozione di iniziative che non contrastino con le finalità formative della scuola e non determinino inopportune forme di commercializzazione, previa autorizzazione:#del consiglio di istituto#del collegio dei docenti#del dirigente scolastico#della giunta esecutiva
DOMANDA 1.38#Ai sensi dell’art. 1, c. 129, della L. 13 luglio 2015, n. 107, il Comitato per la valutazione dei docenti:#ha durata di tre anni scolastici ed è presieduto dal dirigente scolastico#ha durata di due anni scolastici ed è presieduto dal dirigente scolastico#ha durata di un anno scolastico ed è presieduto da un rappresentante dei genitori#viene costituito all’inizio di ogni anno scolastico ed è presieduto da un rappresentante dei genitori
DOMANDA 1.39#Ai sensi dell’art. 8, c. 6, del D.lgs. 16 aprile 1994, n. 297, il consiglio di circolo o d’istituto è presieduto:#da uno dei membri, eletto tra i rappresentanti dei genitori degli alunni#dal dirigente scolastico o da un docente delegato#da un rappresentante del personale amministrativo, tecnico e ausiliario#da uno dei membri, eletto tra i rappresentanti dei docenti
DOMANDA 1.40#Ai sensi dell’art. 7, c. 2, del D.P.R. 8 marzo 1999, n. 275, se un accordo di rete prevede attività didattiche o di ricerca, sperimentazione e sviluppo, di formazione e aggiornamento, è approvato:#dal consiglio di circolo o di istituto e dal collegio dei docenti delle singole scuole interessate per la parte di propria competenza#dal consiglio di circolo o di istituto e dai consigli di classe delle singole scuole interessate per la parte di propria competenza#soltanto dal consiglio di circolo o di istituto delle singole scuole interessate#soltanto dal collegio dei docenti delle singole scuole interessate
DOMANDA 1.41#Ai sensi della L. n. 53/2003, art. 2, comma 1, lettera f), la scuola primaria è articolata:#in un primo anno, teso al raggiungimento delle strumentalità di base, e in due periodi didattici biennali#in un primo biennio, in un terzo anno e in un ulteriore periodo didattico biennale di completamento del percorso disciplinare#in un biennio, teso al raggiungimento delle strumentalità di base, in un secondo biennio di completamento del percorso e in un ultimo anno di raccordo con la scuola secondaria di primo grado#in un primo biennio, teso al raggiungimento delle strumentalità di base, e in un periodo triennale di completamento del percorso e di raccordo con la scuola secondaria di primo grado
DOMANDA 1.43#Sono iscritti alla scuola primaria le bambine e i bambini che compiono sei anni di età entro il 31 dicembre dell’anno scolastico di riferimento. Secondo quanto previsto dal D.P.R. n. 89/2009, art. 4, c. 2, possono, altresì, essere iscritti alla scuola primaria, su richiesta delle famiglie, le bambine e i bambini che compiono sei anni di età entro il:#30 aprile dell’anno scolastico di riferimento#1 settembre dell’anno scolastico di riferimento#1 marzo dell’anno scolastico di riferimento#31 agosto dell’anno scolastico di riferimento
DOMANDA 1.44#Ai sensi dell’art. 4, c. 1, del D.L. n. 137/2008, convertito, con modificazioni, dalla L. 30 ottobre 2008, n. 169, le classi funzionanti con orario di ventiquattro ore settimanali sono affidate:#ad un unico insegnante#ad una pluralità di docenti#a più docenti, anche in compresenza#ad un docente prevalente
DOMANDA 1.45#Quale norma ha abrogato l’esame di licenza elementare?#D.lgs. n. 59/2004, art. 19, c. 3#D.lgs. n. 196/2003, art. 10, c. 1#D.lgs. n. 286/2004, art. 5, c. 2#L. n. 67/2006, art. 3, c. 1
DOMANDA 1.47#Nelle "Indicazioni nazionali per il curricolo della scuola dell’infanzia e del primo ciclo d’istruzione" (D.M. n. 254/2012) la scuola dell’infanzia si pone la finalità di:#promuovere nei bambini lo sviluppo dell’identità, dell’autonomia, della competenza e li avvia alla cittadinanza#promuovere l’alfabetizzazione di base attraverso l’acquisizione dei linguaggi e dei codici che costituiscono la struttura della nostra cultura#favorire l’accesso alle discipline come punti di vista sulla realtà e come modalità di conoscenza, interpretazione e rappresentazione del mondo#offrire l’opportunità di sviluppare le dimensioni cognitive, emotive, affettive, sociali, corporee, etiche e religiose, e di acquisire i saperi irrinunciabili
DOMANDA 1.48#Ai sensi dell’art. 9, comma 2, del D.P.R. n. 81/2009, le sezioni di scuola dell’infanzia sono costituite, di norma, salvo il disposto di cui all’articolo 5, commi 2 e 3, con un numero di bambini:#non inferiore a 18 e non superiore a 26#non inferiore a 15 e non superiore a 26#non inferiore a 18 e non superiore a 27#non inferiore a 15 e non superiore a 27
DOMANDA 1.49#Ai sensi dell’art. 9, comma 3, del D.P.R. n. 81/2009, nella scuola dell'infanzia, ove non sia possibile ridistribuire i bambini tra scuole viciniori, eventuali iscrizioni in eccedenza sono ripartite tra le diverse sezioni della stessa scuola senza superare, comunque, le:#29 unità per sezione, escludendo dalla redistribuzione le sezioni che accolgono alunni con disabilità#27 unità per sezione, includendo nella redistribuzione le sezioni che accolgono alunni con disabilità#28 unità per sezione, includendo nella redistribuzione le sezioni che accolgono alunni con disabilità#30 unità per sezione, escludendo dalla redistribuzione le sezioni che accolgono alunni con disabilità
DOMANDA 1.50#Ai sensi dell’art. 2, comma 2, del D.lgs. n. 65/2017, il sistema integrato di educazione e di istruzione è costituito:#dai servizi educativi per l’infanzia e dalle scuole dell’infanzia statali e paritarie#dai servizi integrativi per l’infanzia e dalle scuole dell’infanzia statali e paritarie#dai servizi educativi per l’infanzia e dalle scuole dell’infanzia statali e comunali#dai servizi integrativi per l’infanzia e dalle scuole dell’infanzia statali e non statali
DOMANDA 1.51#Ai sensi dell’art. 2, comma 3, lettera b), del D.lgs. n. 65/2017, le sezioni primavera accolgono bambine e bambini:#tra ventiquattro e trentasei mesi di età#tra tre e trentasei mesi di età#tra dodici e trentasei mesi di età#tra diciotto e trentasei mesi di età
DOMANDA 1.52#Per fare fronte alla crescente domanda di servizi educativi per i bambini al di sotto dei tre anni di età, quale Legge ha introdotto i progetti tesi all’ampliamento qualificato dell’offerta formativa rivolta a bambini dai 24 ai 36 mesi di età?#L. n. 296/2006#L. n. 59/1997#L. n. 53/2003#L. n. 107/2015
DOMANDA 1.53#Ai sensi dell’art. 2, comma 3, del D.lgs. n. 65/2017, i servizi educativi per l’infanzia sono articolati in:#nidi e micronidi che accolgono le bambine e i bambini tra tre e trentasei mesi di età; sezioni primavera; servizi integrativi#nidi che accolgono le bambine e i bambini tra nove e trentasei mesi di età; sezioni primavera; servizi integrativi#nidi e micronidi che accolgono le bambine e i bambini tra dodici e trentasei mesi di età; sezioni primavera; servizi integrativi#nidi e micronidi che accolgono le bambine e i bambini tra diciotto e trentasei mesi di età; sezioni primavera; servizi integrativi
DOMANDA 1.54#Ai sensi dell’art. 1, comma 4, del D.lgs. n. 65/2017, quale organo indirizza, coordina e promuove il Sistema integrato di educazione e di istruzione su tutto il territorio nazionale?#Il Ministero dell’istruzione, dell’università e della ricerca, nel rispetto delle funzioni e dei compiti delle Regioni, delle Province autonome di Trento e di Bolzano e degli Enti locali#Il Ministero dell’istruzione, dell’università e della ricerca, nel rispetto delle funzioni e dei compiti delle Province autonome di Trento e di Bolzano#Il Ministero dell’istruzione, dell’università e della ricerca, di concerto con il Ministero dell’economia e delle finanze e con il Ministero dell’interno#Il Ministero dell’istruzione, dell’università e della ricerca, di concerto con il Ministero dello sviluppo economico e con il Ministero del lavoro e delle politiche sociali
DOMANDA 1.55#Ai sensi dell’art. 4, comma 1, del D.lgs. n. 65/2017, lo Stato promuove e sostiene la qualificazione dell’offerta dei servizi educativi per l’infanzia e delle scuole dell’infanzia mediante:#il Piano di azione nazionale pluriennale#i Poli per l’infanzia#le Linee guida pedagogiche#la partecipazione economica delle famiglie
DOMANDA 1.56#Ai sensi dell’art. 3, comma 1, del D.lgs. n. 65/2017, i Poli per l’infanzia accolgono, in un unico plesso o in edifici vicini, più strutture di educazione e di istruzione per bambine e bambini:#fino a sei anni di età#tra tre e trentasei mesi di età#tra dodici e trentasei mesi di età#tra diciotto e trentasei mesi di età
DOMANDA 1.57#Ai sensi dell’art. 3, comma 3, del D.lgs.n. 65/2017, i Poli per l’infanzia possono essere costituiti anche:#presso direzioni didattiche o istituti comprensivi del sistema nazionale di istruzione e formazione#presso scuole primarie o scuole secondarie di primo grado del sistema nazionale di istruzione e formazione#presso circoli didattici o istituti omnicomprensivi del sistema nazionale di istruzione e formazione#presso direzioni didattiche statali e non statali del sistema nazionale di istruzione e formazione
DOMANDA 1.58#Ai sensi dell’art. 2, comma 5, del D.lgs. n. 65/2017, la scuola dell’infanzia assume una funzione strategica nel Sistema integrato di educazione e di istruzione operando in continuità con i servizi educativi per l’infanzia e con:#il primo ciclo di istruzione#il Sistema nazionale di valutazione#le direzioni didattiche#le scuole secondarie di primo grado
DOMANDA 1.59#Ai sensi dell’art. 3, comma 1, del D.lgs. n. 65/2017, i Poli per l’infanzia si caratterizzano quali:#laboratori permanenti di ricerca, innovazione, partecipazione e apertura al territorio#laboratori permanenti di autonomia didattica, organizzativa, di ricerca, sperimentazione e sviluppo#servizi integrativi che concorrono all’educazione e alla cura delle bambine e dei bambini#spazi gioco con finalità educative, di cura e di socializzazione con frequenza flessibile
