DOMANDA 1.334#Ai sensi dell'art. 1, comma 76, della Legge n. 107/2015, per quale regione il numero dei posti comuni e di potenziamento dell'offerta formativa è determinato a livello regionale?#Friuli-Venezia Giulia#Sicilia#Sardegna#Piemonte
DOMANDA 1.335#Ai sensi dell'art. 1, comma 121, della Legge n. 107/2015, cosa è stata istituita?#La Carta elettronica per l'aggiornamento e la formazione del personale docente di ruolo#La Conferenza nazionale per il diritto allo studio#La Conferenza nazionale per l'integrazione degli alunni con disabilità#La Cabina di regia nazionale per la formazione del personale scolastico
DOMANDA 1.336#Ai sensi dell'art. 17 del D.P.R. n. 616/1977, sono trasferite alle Regioni le funzioni amministrative dello Stato in materia di:#istruzione artigiana e professionale, assistenza scolastica#scelta dei libri di testo#programmazione dell'offerta formativa#contributi alle scuole non statali
DOMANDA 1.337#Quale norma prevede la sostituzione del Consiglio nazionale della pubblica istruzione con il Consiglio superiore della pubblica istruzione?#D.lgs n. 233/1999#D.P.R n. 275/1999#D.P.R n. 81/2009#D.lgs n. 297/1994
DOMANDA 1.338#Le attività di formazione in servizio dei docenti, ai sensi dell'art. 1, comma 124, della Legge n. 107/2015, devono essere coerenti con:#il piano triennale dell'offerta formativa e i risultati emersi dai piani di miglioramento, sulla base delle priorità indicate nel Piano nazionale di formazione#l'Atto di indirizzo del Ministro ed il Piano della performance relativo all'anno di riferimento#la Programmazione degli interventi a cura dell'Ufficio scolastico regionale#i Piani provinciali di formazione redatti per obiettivi e finalità
DOMANDA 1.339#Ai sensi dell'art. 1, comma 37, della Legge n. 107/2015, è prevista la Carta dei diritti e dei doveri degli studenti in:#alternanza scuola-lavoro#percorsi brevi di formazione professionale#percorsi di studio realizzati all'estero#istruzione domiciliare o ospedaliera
DOMANDA 1.340#Ai sensi dell'art. 2, comma 2, del D.P.R. n. 275/1999, a decorrere da quale data si applica alle istituzioni scolastiche il Regolamento recante norme in materia di autonomia?#1 settembre 2000#1 settembre 2001#31 agosto 2001#1 settembre 1999
DOMANDA 1.341#Ai sensi dell'art. 1, comma 124, della Legge n. 107/2015, con quale periodicità viene adottato con decreto del Ministro dell'istruzione, dell'università e della ricerca il Piano nazionale di formazione?#Ogni tre anni#Ogni anno#Ogni cinque anni#Ogni due anni
DOMANDA 1.342#L'art. 278 del D.lgs. n. 297/1994, concernente la sperimentazione come ricerca e realizzazione di innovazioni degli ordinamenti e delle strutture, è stato abrogato da quale norma?#D.P.R. n. 275/1999#L. n. 53/2003#L. n. 30/2000#D.lgs. n. 81/2009
DOMANDA 1.343#Il Piano di formazione, ai sensi dell'art. 1, comma 124, della Legge n. 107/2015, è destinato ai:#docenti delle scuole di ogni ordine e grado#docenti del primo ciclo di istruzione#docenti del secondo ciclo di istruzione#genitori e agli studenti
DOMANDA 1.344#In quale data è stato adottato il Piano nazionale di formazione dei docenti, previsto dall'art. 1, comma 124, della L. n. 107/2015?#19 ottobre 2016#15 ottobre 2015#1 settembre 2015#15 dicembre 2015
DOMANDA 1.345#Ai sensi dell'art. 139 del D.lgs. n. 112/1998, a chi sono attribuiti i compiti e le funzioni relativi ai servizi di supporto organizzativo del servizio di istruzione per alunni con disabilità nella scuola primaria?#Ai Comuni#Allo Stato#Alle Regioni#Alle Province
DOMANDA 1.346#Ai sensi dell'art. 139 del D.lgs. n. 112/1998, a chi compete la redazione dei piani di organizzazione della rete delle istituzioni scolastiche del primo ciclo?#Ai Comuni#Alle Regioni#Allo Stato#Alle Province
DOMANDA 1.347#Ai sensi dell'art. 139 del D.lgs. n. 112/1998, chi promuove iniziative per l'educazione degli adulti?#I Comuni, anche in collaborazione con le Comunità montane e le Province#La Conferenza Stato-Regioni#Le Regioni#Lo Stato
DOMANDA 1.348#Ai sensi dell'art. 3 della L. Cost. n. 3/2011, lo Stato ha legislazione esclusiva in materia di:#norme generali sull'istruzione#autonomia delle istituzioni scolastiche#istruzione e formazione professionale#organizzazione della rete scolastica
DOMANDA 1.349#Con quale atto è stato adottato il Piano nazionale di formazione dei docenti, previsto dall'art. 1, comma 124, della L. n. 107/2015?#Decreto del Ministro#Atto di indirizzo del Ministro#Decreto del Direttore Generale per il personale scolastico#Decreto del Capo Dipartimento per il sistema educativo di istruzione e formazione
DOMANDA 1.350#Il D.lgs. n. 300/1999 disciplina:#la riorganizzazione delle Amministrazioni centrali e periferiche dello Stato#l'organizzazione delle Regioni#il conferimento dei compiti delle Regioni ai Comuni#il conferimento dei compiti delle Regioni alle Province
DOMANDA 1.351#Ai sensi dell'art. 5, comma 3, del D.Lgs. n. 300/1999, nei Ministeri il Capo del Dipartimento svolge compiti di:#coordinamento, direzione e controllo degli Uffici di livello dirigenziale generale#supporto e raccordo con l'Amministrazione periferica#promozione di attività tecnico-operative di interesse nazionale#diretta collaborazione con il Ministro
DOMANDA 1.352#Quale decreto legislativo, in attuazione dell'art. 1, commi 180 e 181, lettera g), della L. n. 107/2015, è stato emanato in materia di promozione e diffusione della cultura umanistica?#D.lgs. n. 60/2017#D.lgs. n. 61/2017#D.lgs. n. 66/2017#D.lgs. n. 65/2017
DOMANDA 1.353#Ai sensi dell'art. 13, comma 1, del D.lgs. n. 64/2017, qual è il limite complessivo di unità di personale di cui si avvale il MIUR per la gestione, il coordinamento e la vigilanza del sistema della formazione italiana nel mondo?#35#28#70#45
DOMANDA 1.354#Ai sensi dell'art. 13, comma 1, del D.lgs. n. 63/2017, chi può stipulare accordi con soggetti pubblici e privati per implementare i servizi in materia di diritto allo studio e favorire sinergie interistituzionali?#Gli Enti locali#La Regione#Il MIUR#La Conferenza Stato-Regioni
DOMANDA 1.355#Ai sensi dell'art. 8, comma 1, del D.P.C.M. n. 98/2014, quanti sono gli Uffici scolastici regionali di livello dirigenziale generale?#14#18#12#16
DOMANDA 1.356#Ai sensi dell'art. 22, comma 1, del D.lgs. n. 64/2017, l'orario di lavoro del personale inviato all'estero, rispetto a quello in Italia, è:#corrispondente#inferiore#superiore#non flessibile
DOMANDA 1.357#Ai sensi dell'art. 24, comma 2, del D.Lgs. n. 64/2017, per lo svolgimento degli esami di Stato conclusivi del primo e del secondo ciclo d'istruzione nelle scuole italiane all'estero, chi provvede ad inviare il personale necessario alla formazione delle relative commissioni?#Il Ministero degli affari esteri e della cooperazione internazionale di concerto con il Ministero dell'istruzione, dell'università e della ricerca#Il Ministero dell'istruzione, dell'università e della ricerca#Il Ministero degli affari esteri e della cooperazione internazionale#L'Ambasciata o l'Ufficio consolare competente
DOMANDA 1.358#Ai sensi dell'art. 31, comma 2, del D.lgs. n. 64/2017, nelle scuole statali all'estero un numero limitato di insegnamenti obbligatori nell'ordinamento italiano può essere affidato a personale italiano o straniero, residente nel paese da almeno:#un anno#sei anni#due anni#tre anni
DOMANDA 1.359#Ai sensi dell'art. 18, comma 4, del D.lgs. n. 64/2017, il personale amministrativo inviato all'estero può essere destinato a:#scuole statali, rappresentanze diplomatiche o uffici consolari#scuole statali e università#università#uffici consolari
DOMANDA 1.360#Ai sensi dell'art. 3, comma 2, del D.lgs. n. 63/2017, in caso di contribuzione delle famiglie, gli enti locali individuano i criteri di accesso ai servizi e le eventuali fasce tariffarie in considerazione:#del valore dell'indicatore della situazione economica equivalente (ISEE)#del numero dei componenti di età inferiore ad anni 18#del possesso della cittadinanza italiana#della presenza di minori con disabilità
DOMANDA 1.361#Ai sensi dell’art. 5, c. 2, lett. c), del D.lgs. 16 aprile 1994, n. 297, nella scuola secondaria superiore fanno parte del consiglio di classe:#due rappresentanti eletti dai genitori degli alunni iscritti alla classe, nonché due rappresentanti degli studenti, eletti dagli studenti della classe#un rappresentante eletto dai genitori degli alunni iscritti alla classe, nonché tre rappresentanti degli studenti, eletti dagli studenti della classe#un rappresentante eletto dai genitori degli alunni iscritti alla classe, nonché due rappresentanti degli studenti, eletti dagli studenti della classe#un rappresentante eletto dai genitori degli alunni iscritti alla classe, nonché un rappresentante degli studenti, eletto dagli studenti della classe
DOMANDA 1.362#Ai sensi dell’art. 1, c. 14, della L. 13 luglio 2015, n. 107, il Piano triennale dell’offerta formativa è:#elaborato dal collegio dei docenti ed approvato dal consiglio d’istituto#elaborato ed approvato soltanto dal consiglio d’istituto#approvato dal consiglio d’istituto, sentiti i criteri generali forniti dai consigli di classe#approvato dal collegio dei docenti, sentiti i criteri generali forniti dal consiglio d’istituto
DOMANDA 1.363#Ai sensi dell’art. 1, c. 14, della L. 13 luglio 2015, n. 107, il collegio dei docenti:#elabora il Piano triennale dell’offerta formativa, sulla base degli indirizzi per le attività della scuola e delle scelte di gestione e di amministrazione definiti dal dirigente scolastico#elabora il Piano triennale dell'offerta formativa, sulla base degli indirizzi per le attività della scuola e delle scelte di gestione e di amministrazione definiti dai consigli di classe#adotta il Piano triennale dell’offerta formativa, sulla base degli indirizzi per le attività della scuola e delle scelte di gestione e di amministrazione definiti dal consiglio d'istituto#adotta il Piano triennale dell’offerta formativa, sulla base degli indirizzi per le attività della scuola e delle scelte di gestione e di amministrazione definiti dalle realtà istituzionali del territorio
DOMANDA 1.364#Ai sensi dell’art. 1, c. 129, della L. 13 luglio 2015, n. 107, la componente docenti del Comitato per la valutazione dei docenti è costituita da:#tre docenti dell'istituzione scolastica, di cui due scelti dal collegio dei docenti e uno dal consiglio di istituto#quattro docenti dell'istituzione scolastica, di cui due scelti dal collegio dei docenti e due dal consiglio di istituto#tre docenti dell'istituzione scolastica, di cui uno scelto dal collegio dei docenti e due dal consiglio di istituto#quattro docenti dell'istituzione scolastica, di cui tre scelti dal collegio dei docenti e uno dal consiglio di istituto
DOMANDA 1.365#Ai sensi dell’art. 16, c. 1, del D.P.R. 8 marzo 1999, n. 275, gli organi collegiali della scuola garantiscono l'efficacia dell'autonomia delle istituzioni scolastiche:#nel quadro delle norme che ne definiscono competenze e composizione#mediante la definizione degli indirizzi per le attività della scuola e delle scelte di gestione e di amministrazione#da attuare nel sistema integrato di istruzione, formazione, lavoro, sentita la Conferenza unificata#attraverso la riorganizzazione dei servizi amministrativi e contabili
DOMANDA 1.366#Ai sensi dell’art. 8, c. 10, del D.lgs. 16 aprile 1994, n. 297, il consiglio di circolo o d’ istituto dura in carica:#per tre anni scolastici#per un anno scolastico#per due anni scolastici#per un semestre
DOMANDA 1.367#Ai sensi dell’art. 37, c. 2, del D.lgs. 16 aprile 1994, n. 297, per la validità dell’adunanza degli organi collegiali è richiesta la presenza:#di almeno la metà più uno dei componenti in carica#di tutti i componenti in carica#della maggioranza relativa dei componenti in carica#di una maggioranza qualificata dei componenti in carica
DOMANDA 1.368#Ai sensi dell’art. 38, c. 1, del D.lgs. 16 aprile 1994, n. 297, decadono dalla carica i membri eletti e designati che non intervengono senza giustificati motivi:#a tre sedute consecutive dell'organo di cui fanno parte#a due sedute consecutive dell'organo di cui fanno parte#a cinque sedute consecutive dell'organo di cui fanno parte#a quattro sedute consecutive dell'organo di cui fanno parte
DOMANDA 1.369#Ai sensi dell’art. 5, c. 8, del D.lgs. 16 aprile 1994, n. 297, i consigli di intersezione, di interclasse e di classe sono presieduti:#dal dirigente scolastico oppure da un docente, membro del consiglio, suo delegato#da un rappresentante dei genitori#da un coordinatore di dipartimento#dal docente più anziano di età
DOMANDA 1.370#Ai sensi dell'art. 8, c. 7, del D.lgs. 16 aprile 1994, n. 297, la giunta esecutiva è presieduta:#dal dirigente scolastico#dal DSGA#dal presidente del consiglio di istituto#dal docente più anziano di età
DOMANDA 1.371#Ai sensi dell'art. 8, c. 7, del D.lgs. 16 aprile 1994, n. 297, fatta eccezione per il dirigente scolastico e il DSGA che ne fanno parte di diritto, i componenti della giunta esecutiva sono:#eletti dal consiglio di circolo o di istituto fra i suoi componenti#eletti dal collegio dei docenti#designati dal dirigente scolastico#designati dal DSGA
DOMANDA 1.372#Ai sensi dell’art. 8, c. 7 e c. 8, del D.lgs. 16 aprile 1994, n. 297, negli istituti di istruzione secondaria di secondo grado la giunta esecutiva è composta dai seguenti membri eletti:#un docente, una unità di personale ATA, un genitore, uno studente#due docenti, una unità di personale ATA, due genitori#un docente, due unità di personale ATA, un genitore, uno studente#due docenti, una unità di personale ATA, un genitore, uno studente
DOMANDA 1.373#Ai sensi dell’art. 1, c. 129, della L. 13 luglio 2015, n. 107, il componente esterno del Comitato per la valutazione dei docenti è individuato:#dall’ufficio scolastico regionale#dal consiglio di istituto#dal dirigente scolastico#dal collegio dei docenti
DOMANDA 1.374#Ai sensi dell’art. 4, c. 2, del D.P.R. 10 ottobre 1996, n. 567, le iniziative complementari dell'iter formativo, per il necessario coordinamento con le attività curricolari e per l'eventuale adattamento della programmazione didattico-educativa, sono sottoposte al previo esame:#del collegio dei docenti#del consiglio di istituto#dei consigli di classe#del dirigente scolastico
DOMANDA 1.375#Ai sensi dell’art. 1, c. 29, della L. 13 luglio 2015, n. 107, percorsi formativi e iniziative, diretti all’orientamento e a garantire un maggiore coinvolgimento degli studenti nonché la valorizzazione del merito scolastico e dei talenti, sono individuati:#dal dirigente scolastico di concerto con gli organi collegiali#dal collegio dei docenti di concerto con i consigli di classe#dal consiglio di istituto di concerto con i consigli di classe#dal collegio dei docenti di concerto con il consiglio di istituto
DOMANDA 1.376#Ai sensi dell’art. 1, c. 14, della L. 13 luglio 2015, n. 107, gli indirizzi per le attività della scuola e delle scelte di gestione e di amministrazione sono definiti:#dal dirigente scolastico#dal consiglio di istituto#dal collegio dei docenti#dal consiglio di istituto, di concerto con il collegio dei docenti
DOMANDA 1.377#Ai sensi dell’art. 1, c. 12, della L. 13 luglio 2015, n. 107, le istituzioni scolastiche predispongono il piano triennale dell’offerta formativa:#entro il mese di ottobre dell’anno scolastico precedente al triennio di riferimento#prima dell’inizio delle lezioni dell’anno scolastico precedente il triennio di riferimento#al termine dell’anno scolastico precedente il triennio di riferimento#prima dell’inizio delle lezioni del triennio di riferimento
DOMANDA 1.378#Ai sensi dell’art. 10, c. 10, del D.lgs. 16 aprile 1994, n. 297, la giunta esecutiva ha, tra l'altro, il compito di:#curare l’esecuzione delle delibere del consiglio di circolo o di istituto#convocare il consiglio di circolo o di istituto#curare l’esecuzione degli atti amministrativi predisposti dal DSGA#preparare gli atti amministrativi per il DSGA
DOMANDA 1.379#Ai sensi dell’art. 7, c. 2, lett. c), del D.lgs. 16 aprile 1994, n. 297, la suddivisione dell'anno scolastico in due o tre periodi ai fini della valutazione degli alunni è deliberata:#dal collegio dei docenti#dal consiglio di istituto#dal dirigente scolastico#dal collegio dei docenti, sentito il parere del consiglio di istituto
DOMANDA 1.380#Ai sensi dell’art. 7, c. 2, lett. e), del D.lgs. 16 aprile 1994, n. 297, l’adozione dei libri di testo è deliberata:#dal collegio dei docenti, sentiti i consigli di interclasse o di classe#soltanto dai consigli di interclasse#soltanto dai consigli di classe#dai consigli di classe, sentita la giunta esecutiva
DOMANDA 1.381#Ai sensi dell’art. 1, comma 6, del D.P.R. 21 novembre 2007, n. 235, le sanzioni che comportano l’allontanamento superiore a quindici giorni dalla comunità scolastica sono adottate:#dal consiglio di istituto#dal consiglio di classe#dal dirigente scolastico#dal collegio dei docenti
DOMANDA 1.382#Ai sensi dell'art. 8, c. 10, del D.lgs. 16 aprile 1994, n. 297, la giunta esecutiva:#dura in carica tre anni scolastici#dura in carica due anni scolastici#dura in carica un anno scolastico#viene costituita all’inizio di ogni anno scolastico
DOMANDA 1.383#Ai sensi dell’ art. 7, c. 2, lett. a), del D.lgs. 16 aprile 1994, n. 297, il collegio dei docenti ha potere deliberante in materia di:#funzionamento didattico del circolo o dell’istituto#funzionamento amministrativo del circolo o dell’istituto#funzionamento amministrativo e didattico del circolo o dell’istituto#funzionamento amministrativo del circolo o dell’istituto, sentito il DSGA
DOMANDA 1.384#Ai sensi dell’art. 7, c. 2, lett. d), del D.lgs. 16 aprile 1994, n. 297, il Collegio dei docenti valuta l’andamento complessivo dell’azione didattica per verificarne l’efficacia in rapporto agli orientamenti e agli obiettivi programmati:#periodicamente#mensilmente#ogni due mesi#due volte all’anno
DOMANDA 1.385#Ai sensi dell’art. 7, c. 2, lett. g), del D.lgs. 16 aprile 1994, n. 297, il Collegio dei docenti:#promuove iniziative di aggiornamento dei docenti del circolo o dell'istituto#promuove iniziative di aggiornamento dei docenti, tenuto conto dei criteri generali indicati dalla RSU#promuove iniziative di aggiornamento dei docenti, sentita la giunta esecutiva#promuove iniziative di aggiornamento dei docenti, tenuto conto dei criteri generali indicati dal consiglio di circolo o d'istituto
DOMANDA 1.386#Ai sensi dell’art. 7, c. 2, lett. m), del D.lgs. 16 aprile 1994, n. 297, il Collegio dei docenti:#programma ed attua le iniziative per il sostegno degli alunni portatori di handicap#programma e attua le iniziative per il sostegno degli alunni portatori di handicap, sentito il presidente del consiglio di circolo o di istituto#programma e attua le iniziative per il sostegno degli alunni portatori di handicap, sentita la giunta esecutiva#programma ed attua le iniziative per il sostegno degli alunni portatori di handicap, tenuto conto dei criteri generali indicati dal consiglio di circolo o d'istituto
DOMANDA 1.387#Ai sensi dell’art. 13, c. 5, del D.lgs. 16 aprile 1994, n. 297, il comitato studentesco può esprimere pareri o formulare proposte direttamente:#al consiglio di istituto#al collegio dei docenti#al dirigente scolastico#ai consigli di classe
DOMANDA 1.388#Ai sensi dell’art. 13, c. 6, del D.lgs. 16 aprile 1994, n. 297, lo svolgimento dell’assemblea di istituto è consentito:#una volta al mese#ogni quindici giorni#ogni due mesi#una volta al trimestre
DOMANDA 1.389#Ai sensi dell’art. 13, c. 6, del D.lgs. 16 aprile 1994, n. 297, lo svolgimento dell’assemblea di istituto è consentito:#nel limite delle ore di lezione di una giornata#per la durata di due ore#per la durata di tre ore#per la durata di quattro ore
DOMANDA 1.390#Ai sensi dell’art. 13, c. 6, del D.lgs. 16 aprile 1994, n. 297, la partecipazione di esperti all’assemblea di Istituto è autorizzata:#dal consiglio di istituto#dal dirigente scolastico#dal collegio dei docenti#dalla giunta esecutiva
DOMANDA 1.391#Ai sensi dell’art. 13, c. 8, del D.lgs. 16 aprile 1994, n. 297, i docenti che lo desiderino possono assistere all’assemblea di classe o di istituto?#Sì#No#Sì, se autorizzati dal consiglio di istituto#Sì, se autorizzati dal dirigente scolastico
DOMANDA 1.392#Ai sensi dell’art. 13, c. 3, del D.lgs. 16 aprile 1994, n. 297, l’assemblea di istituto può articolarsi in assemblea di classi parallele:#in relazione al numero degli alunni ed alla disponibilità dei locali#su decisione del dirigente scolastico#previa delibera del consiglio di istituto#previa delibera del collegio dei docenti
DOMANDA 1.393#Ai sensi dell’art. 13, c. 7, del D.lgs. 16 aprile 1994, n. 297, le ore destinate alle assemblee studentesche possono essere utilizzate per lo svolgimento di attività di ricerca, di seminario e per lavori di gruppo:#a richiesta degli studenti#a richiesta del dirigente scolastico#previa delibera del consiglio di istituto#previa delibera del collegio dei docenti
DOMANDA 1.394#Ai sensi dell’art. 14, c. 3, del D.lgs. 16 aprile 1994, n. 297, la data di convocazione e l’ordine del giorno dell’assemblea studentesca d'istituto devono essere preventivamente presentati:#al dirigente scolastico#al consiglio di istituto#al collegio dei docenti#alla giunta esecutiva
DOMANDA 1.395#Ai sensi dell’art. 15, c. 5, del D.lgs. 16 aprile 1994, n. 297, la convocazione dell’assemblea di istituto dei genitori è autorizzata:#dal dirigente scolastico, sentita la giunta esecutiva#dal dirigente scolastico, sentito il consiglio di istituto#dal consiglio di istituto#dalla giunta esecutiva
DOMANDA 1.396#Ai sensi dell’art. 5, c. 5, del D.lgs. 16 aprile 1994, n. 297, le funzioni di segretario del consiglio di classe sono attribuite:#dal dirigente scolastico ad uno dei docenti membro del consiglio stesso#dal dirigente scolastico al docente più anziano di età membro del consiglio stesso#dal consiglio di classe ad uno dei docenti membro del consiglio stesso#dal consiglio di classe al docente più giovane di età membro del consiglio stesso
DOMANDA 1.397#Ai sensi dell’art. 2, c. 4, del D.P.R. 10 ottobre 1996, n.567, gli edifici e le attrezzature scolastiche sono utilizzati, anche in orari non coincidenti con quelli delle lezioni, nel pomeriggio e nei giorni festivi, secondo le modalità previste:#dal consiglio di circolo o di istituto#dal collegio dei docenti#dal dirigente scolastico#dalla giunta esecutiva
DOMANDA 1.398#Ai sensi dell’art. 6, c. 1, del D.P.R. 10 ottobre 1996, n. 567, la prima riunione della consulta è convocata dal dirigente dell'ufficio scolastico locale a livello provinciale:#entro quindici giorni dal completamento delle operazioni elettorali#entro dieci giorni dal completamento delle operazioni elettorali#entro venti giorni dal completamento delle operazioni elettorali#entro trenta giorni dal completamento delle operazioni elettorali
DOMANDA 1.399#Ai sensi dell’art. 8, c. 7, del D.lgs. 16 aprile 1994, n. 297, le funzioni di segretario della giunta esecutiva sono svolte:#dal DSGA#dal docente#da un rappresentante dei genitori o degli studenti#dall'unità di personale ATA
DOMANDA 1.400#Ai sensi dell’art. 42, c. 1, del D.lgs. 16 aprile 1994, n. 297, alle sedute del consiglio di istituto possono assistere:#gli elettori delle componenti rappresentate nel consiglio medesimo#soltanto gli elettori della componente docenti rappresentata nel consiglio medesimo#soltanto gli elettori della componente genitori rappresentata nel consiglio medesimo#soltanto gli elettori della componente studenti rappresentata nel consiglio medesimo
DOMANDA 1.401#Ai sensi dell’art. 6, c. 1, del D.P.R. 10 ottobre 1996, n. 567, la durata in carica dei rappresentanti degli studenti nella consulta provinciale è di:#due anni#un anno#tre anni#un semestre
DOMANDA 1.402#Ai sensi dell’art. 3, c. 4, del D.P.R. 10 ottobre 1996, n. 567, l’accettazione di somme provenienti da privati, per la realizzazione delle iniziative complementari e delle attività integrative delle istituzioni scolastiche, è deliberata:#dal consiglio d'istituto#dal collegio dei docenti#dalla giunta esecutiva#dal consiglio scolastico distrettuale
DOMANDA 1.403#Ai sensi dell'art. 7, c. 4, del D.lgs. 16 aprile 1994, n. 297, il collegio dei docenti si riunisce ogni qualvolta il dirigente scolastico ne ravvisi la necessità oppure quando almeno:#un terzo dei suoi componenti ne faccia richiesta; comunque, almeno una volta per ogni trimestre o quadrimestre#un terzo dei suoi componenti ne faccia richiesta; comunque, almeno due volte per ogni trimestre o quadrimestre#un quinto dei suoi componenti ne faccia richiesta; comunque, almeno una volta al mese#un quarto dei suoi componenti ne faccia richiesta; comunque, almeno tre volte per ogni trimestre o quadrimestre
DOMANDA 1.404#Ai sensi dell’art. 7, c. 2, lett. i), del D.lgs. 16 aprile 1994, n. 297, i rappresentanti dei docenti che fanno parte del consiglio di circolo o di istituto sono eletti:#dal collegio dei docenti#dai consigli di classe#dai consigli di interclasse#dalla giunta esecutiva
DOMANDA 1.405#Ai sensi dell’art. 4, c. 1, del D.P.R. 10 ottobre 1996, n. 567, le iniziative complementari e le attività integrative sono deliberate dal consiglio di circolo o di istituto, che ne valuta la coerenza con le finalità formative dell'istituzione scolastica:#sentito il collegio dei docenti#sentito il dirigente scolastico#previo parere dei consigli di classe#previo parere della giunta esecutiva
DOMANDA 1.406#Qual è l’ammontare annuale complessivo di ore previste nelle scuole dell'infanzia per le attività educative in ordine all'insegnamento della religione cattolica nell'arco dell'anno scolastico, come previsto nell'Allegato "Intesa per l'insegnamento della religione cattolica nelle scuole pubbliche" (2.4) al D.P.R. n. 175/2012?#Sessanta#Sessantasei#Cinquanta#Trentatré
