DOMANDA 5.384#Ai sensi dell'art. 19, c. 1 bis, d. lgs. n. 165/2001, l'amministrazione rende conoscibili, anche mediante pubblicazione di apposito avviso sul sito istituzionale#il numero e la tipologia dei posti di funzione che si rendono disponibili nella dotazione organica ed i criteri di scelta#il numero dei posti di funzione che si rendono disponibili nella dotazione organica ed i criteri di scelta#il numero e la tipologia dei posti di funzione che si rendono disponibili nella dotazione organica#il numero e la tipologia dei posti di funzione che si rendono disponibili nel piano triennale di fabbisogno di personale ed i criteri di scelta
DOMANDA 5.385#In caso di primo conferimento ad un dirigente della seconda fascia di incarichi di uffici dirigenziali generali o di funzioni equiparate, ai sensi dell'art. 19, c. 2, d. lgs. n. 165/2001, la durata dell'incarico è pari a#tre anni#un anno#cinque anni#due anni
DOMANDA 5.387#In deroga all'articolo 60 del DPR n. 3/57 (Testo unico delle disposizioni concernenti lo statuto degli impiegati civili dello Stato), i dirigenti delle pubbliche amministrazioni sono collocati#salvo motivato diniego dell'amministrazione di appartenenza in ordine alle proprie preminenti esigenze organizzative, in aspettativa senza assegni per lo svolgimento di attività presso soggetti e organismi, pubblici o privati, anche operanti in sede internazionale#salvo motivato diniego dell'amministrazione di appartenenza in ordine alle proprie preminenti esigenze produttive, in collocamento fuori ruolo per lo svolgimento di attività presso soggetti e organismi, pubblici o privati, anche operanti in sede internazionale#salvo motivato diniego dell'amministrazione di appartenenza in ordine alle proprie preminenti esigenze produttive, in aspettativa senza assegni per lo svolgimento di attività presso soggetti e organismi, pubblici o privati, anche operanti in sede internazionale#salvo motivato diniego dell'amministrazione di appartenenza in ordine alle proprie preminenti esigenze organizzative, in collocamento fuori ruolo per lo svolgimento di attività presso soggetti e organismi, pubblici o privati, non operanti in sede internazionale
DOMANDA 5.388#Ai sensi dell'art. 20, d. lgs. n. 165/2001, per la Presidenza del Consiglio dei ministri le operazioni di verifica dei risultati sono effettuate#dal Ministro per i dirigenti e dal Consiglio dei ministri per i dirigenti preposti ad ufficio di livello dirigenziale generale#dal Ministro per i dirigenti e dal Presidente del Consiglio dei ministri per i dirigenti preposti ad ufficio di livello dirigenziale generale#dal Ministro per i dirigenti e dal Consiglio di gabinetto per i dirigenti preposti ad ufficio di livello dirigenziale generale#dal Ministro per i dirigenti e dal Presidente del Consiglio dei ministri per i dirigenti preposti ad ufficio di livello dirigenziale non generale
DOMANDA 5.389#Nel caso di svolgimento da parte dei dirigenti pubblici di attività presso soggetti diversi dalle amministrazioni pubbliche, il periodo di collocamento in aspettativa di cui all'art. 23 bis, c. 1, d. lgs. n. 165/2001#non può superare i cinque anni e non è computabile ai fini del trattamento di quiescenza e previdenza#non può superare i tre anni e non è computabile ai fini del trattamento di quiescenza e previdenza#non può superare i tre anni ed è computabile ai fini del trattamento di quiescenza e previdenza#non può superare i cinque anni ed è computabile ai fini del trattamento di quiescenza e previdenza
DOMANDA 5.390#Quale tra queste è una funzione dei dirigenti di uffici dirigenziali non generali?#dirigono, coordinano e controllano l'attività degli uffici che da essi dipendono e dei responsabili dei procedimenti amministrativi, anche con poteri sostitutivi in caso di inerzia#formulano proposte ed esprimono pareri al Ministro, nelle materie di sua competenza#adottano gli atti relativi all'organizzazione degli uffici di livello dirigenziale non generale#promuovono e resistono alle liti ed hanno il potere di conciliare e di transigere, fermo restando quanto disposto dall'art. 12, c. 1, l. n.103/79
DOMANDA 5.391#I dirigenti di uffici dirigenziali generali#dirigono, coordinano e controllano l'attività dei dirigenti e dei responsabili dei procedimenti amministrativi, anche con potere sostitutivo in caso di inerzia, e propongono l'adozione, nei confronti dei dirigenti, delle misure previste dall'articolo 21, d. lgs. n. 165/2001#dirigono, coordinano e controllano l'attività dei dirigenti, senza potere sostitutivo in caso di inerzia, e propongono l'adozione, nei confronti dei dirigenti, delle misure previste dall'articolo 21, d. lgs. n. 165/2001#dirigono, coordinano e controllano l'attività dei dirigenti, ma non dei responsabili dei procedimenti amministrativi, anche con potere sostitutivo in caso di inerzia, e propongono l'adozione, nei confronti dei dirigenti, delle misure previste dall'articolo 22, d. lgs. n. 165/2001#dirigono, coordinano e controllano l'attività dei dirigenti, senza potere sostitutivo in caso di inerzia, e propongono l'adozione, nei confronti dei dirigenti, delle misure previste dall'articolo 22, d. lgs. n. 165/2001
DOMANDA 5.392#I dirigenti di uffici dirigenziali non generali, ai sensi dell'art. 17, c. 1, lett. b, d. lgs. n. 165/2001, curano l'attuazione dei progetti e delle gestioni ad essi assegnati dai dirigenti degli uffici dirigenziali generali#adottando i relativi atti e provvedimenti amministrativi ed esercitando i poteri di spesa e di acquisizione delle entrate#formulando proposte ed esprimendo pareri ai dirigenti degli uffici dirigenziali generali#con poteri sostitutivi in caso di inerzia#proponendo le risorse e i profili professionali necessari allo svolgimento dei compiti dell'ufficio cui sono preposti
DOMANDA 5.393#In ciascuna struttura organizzativa non affidata alla direzione del dirigente generale, ai sensi dell'art. 15, c. 3, d. lgs. n. 165/2001#il dirigente preposto all'ufficio di più elevato livello è sovraordinato al dirigente preposto ad ufficio di livello inferiore#il dirigente preposto all'ufficio di più elevato livello coordina le attività dei dirigenti preposti ad ufficio di livello inferiore#il dirigente preposto all'ufficio di più elevato livello non è sovraordinato al dirigente preposto ad ufficio di livello inferiore#il dirigente preposto all'ufficio di più elevato livello esercita poteri di indirizzo e controllo sulla struttura organizzativa
DOMANDA 5.394#Il trattamento accessorio collegato ai risultati deve costituire almeno il 30 per cento della retribuzione complessiva del dirigente#considerata al netto della retribuzione individuale di anzianità e degli incarichi aggiuntivi soggetti al regime dell'onnicomprensività#considerata al lordo della retribuzione individuale di anzianità e degli incarichi aggiuntivi soggetti al regime dell'onnicomprensività#considerata al netto della retribuzione individuale di anzianità, ma non degli incarichi aggiuntivi soggetti al regime dell'onnicomprensività#considerata al lordo della retribuzione individuale di anzianità
DOMANDA 5.397#La parte della retribuzione collegata al raggiungimento dei risultati della prestazione non può essere corrisposta al dirigente responsabile qualora l'amministrazione di appartenenza, decorso il periodo transitorio di sei mesi dalla data di entrata in vigore del d. lgs. di attuazione della l. n. 15/2009, non abbia#predisposto il sistema di valutazione di cui al Titolo II del citato decreto legislativo#stabilito i criteri per l'individuazione dei trattamenti accessori massimi, secondo principi di contenimento della spesa e di uniformità e perequazione#implementato con le risorse necessarie appositi fondi istituiti presso ciascuna amministrazione#istituito i fondi per la perequazione di cui all'art. 2 della l. n. 334/97
DOMANDA 5.398#Tra i principi e criteri direttivi in materia di dirigenza pubblica cui attenersi nell'esercizio di delega legislativa, è stato previsto anche "affermare la piena autonomia e responsabilità del dirigente, in qualità di soggetto che esercita i poteri del datore di lavoro pubblico, nella gestione delle risorse umane, attraverso il riconoscimento in capo allo stesso della competenza con particolare riferimento ai seguenti ambiti: 1) individuazione dei profili professionali necessari allo svolgimento dei compiti istituzionali dell'ufficio al quale è preposto; 2) valutazione del personale e conseguente riconoscimento degli incentivi alla produttività; 3) utilizzo dell'istituto della mobilita' individuale di cui all'articolo 30 del decreto legislativo 30 marzo 2001, n. 165, e successive modificazioni, secondo criteri oggettivi finalizzati ad assicurare la trasparenza delle scelte operate." Quale fonte normativa prevede tale principio?#l. n. 15/09#l. n. 29/93#l. n. 124/2015#l. n. 174/2016
DOMANDA 5.399#Nell'ambito dei rapporti di lavoro alle dipendenze della pubblica amministrazione, i dipendenti possono essere trasferiti all'interno della stessa amministrazione#o, previo accordo tra le amministrazioni interessate, in altra amministrazione, in sedi collocate nel territorio dello stesso comune ovvero a distanza non superiore a cinquanta chilometri dalla sede cui sono adibiti#o, previo accordo tra le amministrazioni interessate, in altra amministrazione, in sedi collocate nel territorio dello stesso comune ovvero a distanza non superiore a settanta chilometri dalla sede cui sono adibiti#o in altra amministrazione, in sedi collocate nel territorio dello stesso comune ovvero a distanza non superiore a settanta chilometri dalla sede cui sono adibiti#o, previo accordo tra le amministrazioni interessate, in altra amministrazione, in sedi collocate nel territorio dello stesso comune
DOMANDA 5.400#I dirigenti di uffici dirigenziali non generali#provvedono alla gestione del personale e delle risorse finanziarie e strumentali assegnate ai propri uffici#definiscono gli obiettivi da perseguire e stabiliscono le conseguenti risorse umane, finanziarie e materiali#adottano gli atti relativi all'organizzazione degli uffici di livello dirigenziale non generale#curano i rapporti con gli uffici dell'Unione europea e degli organismi internazionali nelle materie di competenza secondo le specifiche direttive dell'organo di direzione politica
DOMANDA 5.401#Alle amministrazioni pubbliche è fatto divieto di stipulare contratti di collaborazione che si concretano in prestazioni di lavoro esclusivamente personali, continuative e le cui modalità di esecuzione siano organizzate dal committente anche con riferimento ai tempi e al luogo di lavoro.#I contratti posti in essere in violazione di quanto sopra sono nulli e determinano responsabilità erariale. I dirigenti che violano tale divieto, sono, altresì, responsabili ai sensi dell'articolo 21, d. lgs. n. 165/2001 e ad essi non può essere erogata la retribuzione di risultato#I contratti posti in essere in violazione di quanto sopra sono annullabili e determinano responsabilità erariale. I dirigenti che violano tale divieto, sono, altresì, responsabili ai sensi dell'articolo 21, d. lgs. n. 165/2001 e ad essi non può essere erogata la retribuzione tabellare#I contratti posti in essere in violazione di quanto sopra sono annullabili e determinano responsabilità erariale. I dirigenti che violano tale divieto, sono, altresì, disciplinarmente responsabili e ad essi non può essere erogata la retribuzione di risultato#I contratti posti in essere in violazione di quanto sopra sono annullabili e determinano responsabilità erariale. I dirigenti che violano tale divieto, sono, altresì, disciplinarmente responsabili e ad essi non può essere erogata la retribuzione tabellare
DOMANDA 5.403#Ai sensi dell'art. 22 , d. lgs. n. 165/2001, il parere del Comitato dei garanti sui provvedimenti adottati ai sensi dell'art. 21, c. 1 e i bis, d. lgs. n. 165/2001 viene reso entro il termine di#quarantacinque giorni dalla richiesta; decorso inutilmente tale termine si prescinde dal parere#trenta giorni dalla richiesta; decorso inutilmente tale termine si prescinde dal parere#quarantacinque giorni dalla richiesta; decorso inutilmente tale termine parere si considera favorevole#trenta giorni dalla richiesta; decorso inutilmente tale termine il parere si considera favorevole
DOMANDA 5.404#Ai sensi dell'art. 22, d. lgs. n. 165/2001, i componenti del Comitato dei garanti#sono collocati fuori ruolo e il posto corrispondente nella dotazione organica dell'amministrazione di appartenenza è reso indisponibile per tutta la durata del mandato#sono collocati in aspettativa con assegni e il posto corrispondente nella dotazione organica dell'amministrazione di appartenenza è considerato vacante per tutta la durata del mandato#sono collocati in aspettativa senza assegni e il posto corrispondente nella dotazione organica dell'amministrazione di appartenenza è considerato vacante per tutta la durata del mandato#sono collocati fuori ruolo e il posto corrispondente nella dotazione organica dell'amministrazione di appartenenza è considerato vacante per tutta la durata del mandato
DOMANDA 5.405#Il Comitato dei garanti di cui all'art. 22, d. lgs. n. 165/2001 è composto da un consigliere della Corte dei conti, designato dal suo Presidente, e da quattro componenti designati rispettivamente#uno dal Presidente della Commissione di cui all'articolo 13 del decreto legislativo di attuazione della legge n. 15/09, uno dal Ministro per la pubblica amministrazione e l'innovazione e due scelti tra dirigenti di uffici dirigenziali generali di cui almeno uno appartenente agli Organismi indipendenti di valutazione#due dal Presidente della Commissione di cui all'articolo 13 del decreto legislativo di attuazione della l. n. 15/09 e due scelti tra dirigenti di uffici dirigenziali generali di cui almeno uno appartenente agli Organismi indipendenti di valutazione#uno dal Presidente del Consiglio dei Ministri, uno dal Ministro per la pubblica amministrazione e l'innovazione e due scelti tra dirigenti di uffici dirigenziali generali di cui almeno uno appartenente agli Organismi indipendenti di valutazione#uno dal Presidente della Commissione di cui all'articolo 13 del decreto legislativo di attuazione della legge n. 15/09, uno dal Ministro dello sviluppo economico e due scelti tra dirigenti di uffici dirigenziali generali di cui almeno uno appartenente agli Organismi indipendenti di valutazione
DOMANDA 5.406#"Al dirigente spetta l’adozione degli atti e provvedimenti amministrativi, compresi tutti gli atti che impegnano l’amministrazione verso l’esterno, nonché la gestione finanziaria, tecnica e amministrativa mediante autonomi poteri di spesa, di organizzazione delle risorse umane, strumentali e di controllo. Lo stesso è responsabile in via esclusiva dell’attività amministrativa, della gestione e dei relativi risultati, secondo quanto previsto dall’art. 4, comma 3, del d. lgs. n. 165/2001". Così recita#l'art. 14 CCNL normativo 2006-2009 AREA V (dirigenza scolastica)#l'art. 28 Cost.#l'art. 5, c. 2, l. n. 15/09#l'art. 23, d. lgs. n. 150/09
DOMANDA 5.408#Le violazioni da parte dei dirigenti degli obblighi di cui all’art. 14, CCNL normativo 2006-2009 Area Dirigenza Scuola, secondo la gravità dell’infrazione ed in relazione a quanto previsto dall’art. 16 (codice disciplinare), previo procedimento disciplinare, danno luogo all’applicazione delle seguenti sanzioni:#sanzione pecuniaria da un minimo di € 150,00 ad un massimo di € 350,00; sospensione dal servizio con privazione della retribuzione, secondo le previsioni del successivo art. 16 (codice disciplinare); licenziamento con preavviso; licenziamento senza preavviso#sanzione pecuniaria da un minimo di € 350,00 ad un massimo di € 500,00; sospensione dal servizio con privazione della retribuzione, secondo le previsioni del successivo art. 16 (codice disciplinare); licenziamento con preavviso; licenziamento senza preavviso#sanzione pecuniaria da un minimo di € 150,00 ad un massimo di € 350,00; sospensione dal servizio con privazione della anzianità di servizio, secondo le previsioni del successivo art. 16 (codice disciplinare); licenziamento con preavviso; licenziamento senza preavviso#sanzione pecuniaria da un minimo di € 350,00 ad un massimo di € 500,00; sospensione dal servizio con privazione della retribuzione, secondo le previsioni del successivo art. 16 (codice disciplinare); licenziamento con preavviso; licenziamento senza giusta causa
DOMANDA 5.410#La Valutazione d'impatto sulla protezione dei dati è prevista#dall'art. 35 del Reg. UE/2016/679#dall'art. 22, l. n. 241/90#dall'art. 60, d. lgs. n. 196/2003#dall'art. 59, l. n. 675/96
DOMANDA 5.411#Ai sensi dell'art. 28, d. lgs. n. 193/2006, il titolare del trattamento dei dati, quando il trattamento è effettuato da una persona giuridica, da una pubblica amministrazione o da un qualsiasi altro ente, associazione od organismo#è l'entità nel suo complesso o l'unità od organismo periferico che esercita un potere decisionale del tutto autonomo sulle finalità e sulle modalità del trattamento, ivi compreso il profilo della sicurezza#è l'entità nel suo complesso o l'unità od organismo periferico che non esercita un potere decisionale del tutto autonomo sulle finalità e sulle modalità del trattamento, ivi compreso il profilo della sicurezza#è l'entità nel suo complesso o l'unità od organismo periferico che non esercita un potere decisionale del tutto autonomo sulle finalità e sulle modalità del trattamento, escluso il profilo della sicurezza#è l'entità nel suo complesso o l'unità od organismo periferico che esercita un potere decisionale del tutto autonomo sulle finalità e sulle modalità del trattamento, escluso il profilo della sicurezza
DOMANDA 5.412#Quale articolo del d. lgs. n. 165/2001 prevede che il dirigente scolastico, nello svolgimento delle proprie funzioni organizzative e amministrative possa avvalersi di docenti da lui individuati, ai quali possono essere delegati specifici compiti?#art. 25#art. 24#art. 26#art. 22
DOMANDA 5.413#Il dirigente scolastico, nello svolgimento delle proprie funzioni organizzative e amministrative#può avvalersi di docenti da lui individuati, ai quali possono essere delegati specifici compiti#può avvalersi di docenti da lui individuati, ai quali possono essere delegate tutte le funzioni, ad eccezione degli obblighi cui è tenuto in qualità di datore di lavoro#può avvalersi esclusivamente del responsabile amministrativo, a cui possono essere delegati specifici compiti#può avvalersi di collaboratori esterni da lui individuati, in funzione di ausiliari di segreteria
DOMANDA 5.414#Quali figure, di norma, collaborano con il dirigente scolastico nello svolgimento delle proprie funzioni organizzative ed amministrative?#docenti collaboratori, direttore dei servizi generali e amministrativi e docenti incaricati delle funzioni strumentali al POF#responsabile dei servizio di prevenzione e protezione e docenti incaricati delle funzioni strumentali al POF#docenti collaboratori e docenti incaricati delle funzioni strumentali al POF#docenti collaboratori e ausiliari di segreteria
DOMANDA 5.415#Ai sensi dell'art. 34, CCNL normativo 2006 - 2009 Scuola, le collaborazioni con il dirigente scolastico#sono riferibili a due unità di personale docente retribuibili, in sede di contrattazione d'istituto, con i finanziamenti a carico del fondo per le attività aggiuntive previste per le collaborazioni col dirigente scolastico#sono riferibili a tre unità di personale docente retribuibili, in sede di contrattazione d'istituto, con i finanziamenti a carico del fondo per le attività aggiuntive previste per le collaborazioni col dirigente scolastico#sono riferibili a tre unità di personale docente retribuibili, in sede di contrattazione nazionale, con i finanziamenti a carico del fondo per le attività aggiuntive previste per le collaborazioni con i dirigenti scolastici#sono riferibili a due unità di personale docente retribuibili, in sede di contrattazione nazionale, con i finanziamenti a carico del fondo per le attività aggiuntive previste per le collaborazioni con i dirigenti scolastici
DOMANDA 5.416#Ai sensi dell'art. 89 del CCNL normativo 2006 - 2009 Scuola, al personale DSGA possono essere corrisposti, fatto salvo quanto previsto dall’art. 88, comma 2, lettera i), esclusivamente i seguenti compensi a carico del fondo d'istituto#per compensi per lavoro straordinario per un massimo di 100 ore annue e per attività e prestazioni aggiuntive connesse a progetti finanziati con risorse dell’UE, da enti pubblici e da soggetti privati#per compensi per lavoro straordinario per un massimo di 150 ore annue e per attività e prestazioni aggiuntive connesse a progetti finanziati con risorse dell’UE, da enti pubblici e da soggetti privati#per compensi per lavoro straordinario per un massimo di 150 ore annue#per compensi per lavoro straordinario per un massimo di 150 ore annue e per attività e prestazioni aggiuntive connesse a progetti finanziati con risorse dell’UE
DOMANDA 5.417#In quale Area della tabella A (Profili di Area del personale ATA) del CCNL normativo 2006-2009 Scuola rientra il direttore dei servizi generali e amministrativi?#D#A#B#C
DOMANDA 5.418#"Il responsabile amministrativo assume funzioni di direzione dei servizi di segreteria nel quadro dell'unità di conduzione affidata al dirigente scolastico". Così dispone#l'art. 16, D.P.R. n. 275/99#l'art. 25, d. lgs. n. 165/2001#l'art. 14, CCNL normativo 2006-2009 Scuola#l'art. 454, d. lgs. n. 297/94
DOMANDA 5.419#Ai sensi dell'art. 421, d. lgs. n. 297/94, le commissioni dei concorsi a posti di ispettore tecnico sono nominate con decreto del direttore generale o capo del servizio centrale competente e sono composte da#tre docenti universitari, dei quali almeno due che professino un insegnamento compreso nel settore disciplinare di cui trattasi; un funzionario dell'amministrazione della pubblica istruzione con qualifica di dirigente; un ispettore tecnico#tre docenti universitari, dei quali almeno due che professino un insegnamento compreso nel settore disciplinare di cui trattasi; due ispettori tecnici; un funzionario dell'amministrazione della pubblica istruzione con qualifica di dirigente#tre docenti universitari, dei quali almeno uno che professi un insegnamento compreso nel settore disciplinare di cui trattasi; due ispettori tecnici; un funzionario dell'amministrazione della pubblica istruzione con qualifica di dirigente#tre docenti universitari, dei quali almeno uno che professi un insegnamento compreso nel settore disciplinare di cui trattasi; un funzionario dell'amministrazione della pubblica istruzione con qualifica di dirigente; un ispettore tecnico
DOMANDA 5.420#"Il comma 5 dell'articolo 25 del decreto legislativo 30 marzo 2001, n. 165, si interpreta nel senso che la delega ai docenti di compiti non costituisce affidamento di mansioni superiori o di funzioni vicarie, anche nel caso in cui detti docenti godano dell'esonero o semiesonero ai sensi dell'articolo 459 del decreto legislativo n. 297 del 1994. Il docente delegato può essere retribuito esclusivamente a carico dei fondi disponibili per la remunerazione accessoria presso la specifica istituzione scolastica od educativa ai sensi dell'articolo 88, comma 2, lettera f), del ccnl relativo al personale scolastico". Così dispone#l'art. 14, c. 22, D.L. n. 95/2012, convertito con modificazioni dalla l. n. 135/2012#l'art. 14, c. 22, l. n. 106/2011#l'art. 14, c. 22, l. n. 350/2003#l'art. 14, c.22, l. n. 124/2015
DOMANDA 5.421#Il responsabile amministrativo#sovrintende, con autonomia operativa, nell'ambito delle direttive di massima impartite e degli obiettivi assegnati, ai servizi amministrativi ed ai servizi generali dell'istituzione scolastica, coordinando il relativo personale#sovrintende, con piena autonomia operativa, ai servizi amministrativi ed ai servizi generali dell'istituzione scolastica, coordinando il relativo personale#sovrintende, con piena autonomia operativa, ai servizi amministrativi ed ai servizi generali dell'istituzione scolastica, ma le gestione del relativo personale spetta al dirigente scolastico#sovrintende, con autonomia amministrativo-contabile, nell'ambito degli obiettivi assegnati, ai servizi amministrativi ed ai servizi generali dell'istituzione scolastica, coordinando il relativo personale con direttive di massima
DOMANDA 5.422#Il dirigente scolastico, sulla base dei criteri individuati dal comitato per la valutazione dei docenti#assegna annualmente al personale docente una somma del fondo di cui all'art. 1, c. 126, l. n. 107/2015, sulla base di motivata valutazione#assegna annualmente al personale docente una somma del fondo di cui all'art. 88 c.2, CCNL normativo 2006-2009 Scuola sulla base di motivata valutazione#assegna annualmente al personale docente una somma del fondo di cui all'art. 88 c.2, CCNL normativo 2006-2009 Scuola sulla base della consistenza del personale docente di ruolo assegnato all'istituzione scolastica#assegna annualmente al personale docente una somma del fondo di cui all'art. 1, c. 126, l. n. 107/2015, sulla base di motivata valutazione del Consiglio d'istituto
DOMANDA 5.423#Ai sensi dell'art. 1, c.128, l. n. 107/2015, la somma di cui al comma 127, definita bonus, è destinata a valorizzare il merito#del personale docente di ruolo delle istituzioni scolastiche di ogni ordine e grado e ha natura di retribuzione accessoria#del personale docente di ruolo e non di ruolo delle istituzioni scolastiche di ogni ordine e grado e viene calcolata nello stipendio tabellare#del personale docente di ruolo delle istituzioni scolastiche di ogni ordine e grado e viene calcolata nello stipendio tabellare#del personale docente di ruolo delle istituzioni scolastiche primarie e ha natura di retribuzione accessoria
