DOMANDA 1.110#L’articolo 8, comma 2, lettera b), del D.P.R. n. 88/2010 prevede, per gli istituti tecnici, l’insegnamento di una disciplina non linguistica, compresa nell’area di indirizzo del quinto anno, esplicitamente in:#lingua inglese#lingua straniera#lingua comunitaria#lingua francese
DOMANDA 1.111#Gli istituti tecnici, a norma dell’articolo 5, comma 3, lettera a), del D.P.R. n. 88/2010, possono utilizzare la quota di autonomia del:#20% dei curricoli, fermo restando che ciascuna disciplina non può essere decurtata per più del 20%#25% dei curricoli, fermo restando che ciascuna disciplina non può essere decurtata per più del 20%#30% dei curricoli, fermo restando che ciascuna disciplina non può essere decurtata per più del 30%#25% dei curricoli, fermo restando che ciascuna disciplina non può essere decurtata per più del 25%
DOMANDA 1.112#Quali tipologie di istituti prevedono, a norma dell’articolo 4, comma 3, del D.P.R. n. 87/2010 e dell’articolo 4, comma 3, del D.P.R. n. 88/2010, la presenza di un ufficio tecnico?#Gli istituti tecnici per il settore tecnologico e gli istituti professionali per il settore industria e artigianato#Gli istituti tecnici per il settore economico e gli istituti professionali per il settore industria e artigianato#Gli istituti tecnici per il settore economico e gli istituti professionali per il settore dei servizi#Gli istituti tecnici per il settore tecnologico e gli istituti professionali per il settore dei servizi
DOMANDA 1.113#A norma dell’articolo 2, comma 3, del D.P.R. n. 88/2010, gli istituti tecnici collaborano con le strutture formative accreditate dalle Regioni:#nei Poli tecnico professionali#negli Istituti tecnici superiori#nei Politecnici#nell’Istruzione e formazione professionale
DOMANDA 1.114#Quale degli indirizzi sotto elencati rientra (a norma dell’articolo 3, comma 1, del D.P.R. n. 88/2010) tra gli istituti tecnici per il settore economico?#Turismo#Sistema moda#Trasporti e logistica#Informatica e telecomunicazioni
DOMANDA 1.115#L’articolo 4, comma 1, del D.P.R. n. 88/2010 elenca gli indirizzi degli istituti tecnici per il settore tecnologico; quale degli indirizzi sotto indicati appartiene, invece, al settore economico e non a quello tecnologico?#Amministrazione, finanza e marketing#Grafica e comunicazione#Costruzioni, ambiente e territorio#Sistema moda
DOMANDA 1.116#Secondo le previsioni dell’articolo 4, comma 3, del D.P.R. n. 88/2010, quale compito ha, negli istituti tecnici per il settore tecnologico, l’ufficio tecnico?#Sostenere la migliore organizzazione e funzionalità dei laboratori a fini didattici e il loro adeguamento in relazione alle esigenze poste dall’innovazione tecnologica, nonché per la sicurezza delle persone e dell’ambiente#Esercitare funzioni consultive e di proposta per l’organizzazione delle aree di indirizzo e l’utilizzazione degli spazi di autonomia e flessibilità#Definire indicatori per la valutazione e l’autovalutazione degli istituti tecnici, anche con riferimento al quadro europeo per la garanzia della qualità dei sistemi di istruzione e formazione#Collaborare nella definizione di azioni a sostegno dell’autonomia organizzativa e didattica delle istituzioni scolastiche, anche in relazione all’evoluzione strumentale nell’ambito delle nuove tecnologie
DOMANDA 1.117#L’articolo 8, comma 6, del D.P.R. n. 87/2010 stabilisce che il passaggio al nuovo ordinamento degli istituti professionali:#è definito da linee guida a sostegno dell'autonomia organizzativa e didattica delle istituzioni scolastiche#è definito con decreto del Ministro dell’istruzione, dell’università e della ricerca#è definito da indicazioni nazionali adottate ai sensi del presente regolamento#è definito previo parere della Conferenza permanente per i rapporti tra lo Stato, le Regioni e le Province autonome di Trento e Bolzano
DOMANDA 1.118#Quanti settori e indirizzi sono complessivamente previsti per gli istituti tecnici, ai sensi dell'art. 3, comma 1 e dell'art. 4, comma 1, del D.P.R. n. 88/2010?#2 settori e 11 indirizzi#3 settori e 11 indirizzi#2 settori e 6 indirizzi#3 settori e 6 indirizzi
DOMANDA 1.119#A norma dell’articolo 5, comma 1, lettera a), del D.P.R. n. 88/2010, negli istituti tecnici la declinazione dei risultati di apprendimento in competenze, abilità e conoscenze è effettuata:#dalle istituzioni scolastiche, nella loro autonomia, sulla base di specifiche linee guida#dalle istituzioni scolastiche, nella loro autonomia, sulla base delle indicazioni nazionali di cui al D.M. n. 211/2010#dalle istituzioni scolastiche, nella loro autonomia, sulla base dei programmi nazionali emanati con specifico decreto ministeriale#dalle istituzioni scolastiche, nella loro autonomia, sulla base dell’Allegato A al D.lgs. n. 226/2005
DOMANDA 1.120#A norma dell’articolo 5, comma 1, lettera b), del D.P.R. n. 88/2010, l'orario complessivo annuale degli istituti tecnici:#è determinato in 1.056 ore, corrispondente a 32 ore settimanali di lezione, comprensive della quota riservata alle regioni e dell'insegnamento della religione cattolica#è determinato in 990 ore, corrispondente a 30 ore settimanali di lezione, comprensive della quota riservata alle regioni e dell'insegnamento della religione cattolica#è determinato in 1.122 ore, corrispondente a 34 ore settimanali di lezione, comprensive della quota riservata alle regioni e dell'insegnamento della religione cattolica#è determinato in 1.023 ore, corrispondente a 31 ore settimanali di lezione, comprensive della quota riservata alle regioni e dell'insegnamento della religione cattolica
DOMANDA 1.121#Ai sensi dell’articolo 2, comma 1, del D.P.R. n. 88/2010, l’identità degli istituti tecnici:#si caratterizza per una solida base culturale di carattere scientifico e tecnologico in linea con le indicazioni dell'Unione europea, costruita attraverso lo studio, l'approfondimento e l'applicazione di linguaggi e metodologie di carattere generale e specifico#si caratterizza per gli strumenti culturali e metodologici che garantiscono allo studente una comprensione approfondita della realtà, affinché egli si ponga, con atteggiamento razionale, creativo, progettuale e critico, di fronte alle situazioni, ai fenomeni e ai problemi#si caratterizza per la presenza di abilità coerenti con le capacità e le scelte personali e adeguate al proseguimento degli studi di ordine superiore, all’inserimento nella vita sociale e nel mondo del lavoro#si caratterizza per una solida base di istruzione generale e tecnico-professionale, che consente agli studenti di sviluppare, in una dimensione operativa, saperi e competenze necessari per rispondere alle esigenze formative del settore produttivo di riferimento
DOMANDA 1.122#Ai sensi dell’articolo 5, comma 1, lettera d), del D.P.R. n. 88/2010, in relazione agli istituti tecnici l'area di istruzione generale:#è comune a tutti i percorsi e le aree di indirizzo#è comune a tutte le articolazioni e le curvature#è comune a tutti i percorsi e le curvature#è comune a tutte le sezioni e le opzioni
DOMANDA 1.123#Quale o quali dei seguenti documenti relativi all'istruzione secondaria di secondo grado contengono, in allegato, un glossario per rendere il linguaggio utilizzato più comprensibile?#Le Linee Guida per il passaggio al nuovo ordinamento degli Istituti Tecnici (emanate con Direttiva Miur 15 luglio 2010, n.57) e le Linee Guida per il passaggio al nuovo ordinamento degli Istituti Professionali (emanate con Direttiva Miur 28 luglio 2010, n. 65)#Le Indicazioni Nazionali per i Licei (adottate con D.M. 7 ottobre 2010, n. 211), le Linee Guida per il passaggio al nuovo ordinamento degli Istituti Tecnici (emanate con Direttiva Miur 15 luglio 2010, n.57) e le Linee Guida per il passaggio al nuovo ordinamento degli Istituti Professionali (emanate con Direttiva Miur 28 luglio 2010, n. 65)#Solo le Linee Guida per il passaggio al nuovo ordinamento degli Istituti Tecnici (emanate con Direttiva Miur 15 luglio 2010, n.57)#Solo le Linee Guida per il passaggio al nuovo ordinamento degli Istituti Professionali (emanate con Direttiva Miur 28 luglio 2010, n. 65)
DOMANDA 1.124#Quale delle seguenti fonti normative ha disposto il riordino e il potenziamento degli istituti tecnici e degli istituti professionali?#Il D.L. 31 gennaio 2007, n.7 convertito con modificazioni dalla L. 2 aprile 2007, n.40#La L. 28 marzo 2003, n.53#Il D.lgs. 17 ottobre 2005, n. 226#Il D.L. 25 giugno 2008, n. 112 convertito con modificazioni dalla L. 6 agosto 2008, n. 133
DOMANDA 1.125#Secondo quanto previsto dall’articolo 2, comma 2, del D.P.R. n. 88/2010, nei percorsi degli istituti tecnici quale insegnamento è impartito secondo le Indicazioni nazionali relative al medesimo insegnamento dei percorsi liceali?#L'insegnamento di scienze motorie#L'insegnamento di lingua e letteratura italiana#L'insegnamento di matematica#L'insegnamento di lingua inglese
DOMANDA 1.126#Il D.L. 12 settembre 2013, n. 104, convertito con modificazioni dalla L. 8 novembre 2013, n. 128, ha integrato i quadri orari dei percorsi degli istituti tecnici e professionali (previsti dai D.P.R. n. 87/2010 e n. 88/2010), in una delle due classi del primo biennio, con un'ora di insegnamento di:#geografia generale ed economica laddove non sia già previsto l'insegnamento di geografia#diritto ed economia laddove non sia già previsto l'insegnamento di diritto#complementi di matematica laddove non sia già previsto l'insegnamento di matematica#elementi di informatica laddove non sia già previsto l'insegnamento di informatica
DOMANDA 1.127#L’utilizzazione della quota di autonomia negli istituti tecnici è normata dal D.P.R. n. 88/2010, articolo 5, comma 3. In relazione a tale quota di autonomia, quale delle seguenti affermazioni è falsa?#La quota di autonomia può essere impiegata per articolare in opzioni le aree di indirizzo, in deroga ai limiti del contingente di organico assegnato#La quota di autonomia può essere utilizzata per potenziare gli insegnamenti obbligatori per tutti gli studenti, con particolare riferimento alle attività di laboratorio#La quota di autonomia è determinata in base all'orario complessivo delle lezioni previsto per il primo biennio e per il complessivo triennio, tenuto conto delle richieste degli studenti e delle loro famiglie#La quota di autonomia può essere utilizzata per attivare ulteriori insegnamenti, finalizzati al raggiungimento degli obiettivi previsti dal piano dell'offerta formativa
DOMANDA 1.128#Con riferimento all'orario annuale delle lezioni, quali spazi di flessibilità sono previsti per gli istituti tecnici nell’articolo 5, comma 3, lettera b), del D.P.R. n. 88/2010?#Entro il 30% nel secondo biennio e il 35% nell'ultimo anno#Entro il 20% nel secondo biennio e il 25% nell'ultimo anno#Entro il 20% nel secondo biennio e il 35% nell'ultimo anno#Entro il 30% nel secondo biennio e il 25% nell'ultimo anno
DOMANDA 1.129#A norma dell’articolo 2, comma 1, del D.P.R. n. 88/2010, l’identità degli istituti tecnici è espressa da:#un limitato numero di ampi indirizzi, correlati a settori fondamentali per lo sviluppo economico e produttivo del Paese#un ampio numero di indirizzi, prevalentemente correlati a settori fondamentali per lo sviluppo economico e produttivo del Paese#un limitato numero di opzioni, correlate a aree produttive fondamentali per lo sviluppo economico del Paese#un ampio numero di opzioni, correlate a aree produttive fondamentali per lo sviluppo economico del Paese
DOMANDA 1.130#La declinazione dei risultati di apprendimento in conoscenze e abilità per il primo biennio degli istituti tecnici è contenuta:#nelle Linee Guida per il passaggio al nuovo ordinamento degli Istituti Tecnici emanate con Direttiva Miur 15 luglio 2010, n.57#nell’Allegato A al D.P.R. n. 88/2010, contenente il Profilo educativo, culturale e professionale dello studente (PECUP) per gli istituti tecnici#negli Allegati B e C al D.P.R. n. 88/2010, che contengono indirizzi, profili, quadri orari e risultati di apprendimento degli istituti tecnici#nelle Indicazioni Nazionali per il passaggio al nuovo ordinamento degli Istituti Tecnici adottate con D.M. n. 211 del 7 ottobre 2010
DOMANDA 1.131#Le Linee Guida per il passaggio al nuovo ordinamento degli Istituti Tecnici, emanate con Direttiva Miur 15 luglio 2010, n.57, prevedono una sezione dedicata alle “Azioni per il passaggio al nuovo ordinamento”. Tra quelle sotto elencate, quale azione non è prevista?#Conoscere gli aspetti fondamentali della cultura letteraria, artistica, filosofica e religiosa europea#Motivare gli studenti a costruire il proprio progetto di vita e di lavoro#Realizzare “alleanze formative” sul territorio con il mondo del lavoro, delle professioni e della ricerca#Progettare e valutare per competenze
DOMANDA 1.132#Gli istituti professionali per il settore industria e artigianato, a norma dell’articolo 4, comma 1, del D.P.R. n. 87/2010, prevedono due indirizzi: quali?#Produzioni industriali ed artigianali; Manutenzione e assistenza tecnica#Produzioni industriali ed artigianali; Meccanica, meccatronica ed energia#Agraria, agroalimentare e agroindustria; Manutenzione e assistenza tecnica#Trasporti e logistica; Meccanica, meccatronica ed energia
DOMANDA 1.134#Nel Regolamento di cui al D.P.R. n. 87/2010, recante norme per il riordino degli istituti professionali, l’insegnamento di una disciplina non linguistica in lingua straniera:#non è previsto#può essere impartito solo in lingua inglese#può riguardare solo le discipline dell’area d’indirizzo#può riguardare tanto le discipline dell’area generale quanto quelle dell’area d’indirizzo
DOMANDA 1.135#A norma degli articoli 3 e 4 del D.P.R. n. 87/2010, a quanti e quali settori attengono i percorsi degli istituti professionali?#2 settori: servizi, industria e artigianato#2 settori: economico, tecnologico#3 settori: industria e artigianato, servizi economici, servizi tecnologici#3 settori: industria, artigianato e servizi
DOMANDA 1.139#Il numero degli Uffici di livello dirigenziale generale in cui, secondo l’art. 5, comma 4, del D.P.C.M. n. 98 dell'11 febbraio 2014, si articola il Dipartimento per il sistema educativo di istruzione e formazione è:#tre#nove#cinque#quattro
DOMANDA 1.146#Ai sensi dell'art. 5, comma 4, del D.P.C.M. n. 98 dell'11 febbraio 2014, il Dipartimento per il sistema educativo di istruzione e formazione si articola nelle Direzioni Generali per:#gli ordinamenti scolastici e la valutazione del sistema nazionale di istruzione; il personale scolastico; lo studente, l’integrazione e la partecipazione#gli ordinamenti scolastici; la valutazione del sistema nazionale di istruzione; il personale scolastico#il personale scolastico; lo studente; l’integrazione e la partecipazione#gli ordinamenti scolastici; il personale scolastico; la promozione dell’inclusione scolastica
DOMANDA 1.147#Ai sensi dell'art. 6, comma 4, del D.P.C.M. n. 98 dell'11 febbraio 2014, il Dipartimento per la formazione superiore e per la ricerca si articola nelle Direzioni Generali per:#la programmazione, il coordinamento e il finanziamento delle istituzioni della formazione superiore; lo studente, lo sviluppo e l’internazionalizzazione della formazione superiore; il coordinamento, la promozione e la valorizzazione della ricerca#la programmazione; il coordinamento e il finanziamento delle istituzioni della formazione superiore; lo studente#la programmazione; lo sviluppo e l’internazionalizzazione della formazione superiore; il personale scolastico#la programmazione, il coordinamento e il finanziamento delle istituzioni della formazione superiore; il coordinamento, la promozione e la valorizzazione della ricerca scientifica; lo studente e il personale scolastico
DOMANDA 1.148#Secondo l’art. 8, comma 1, del D.P.C.M. n. 98 dell'11 febbraio 2014, gli Uffici scolastici regionali sono uffici di livello dirigenziale:#generale o, in relazione alla popolazione studentesca della relativa Regione, di livello non generale#generale o, in relazione alle risorse umane e finanziarie, di livello non generale#generale o, in relazione alle istituzioni scolastiche autonome della relativa Regione, di livello non generale#non generale
DOMANDA 1.149#Gli Uffici scolastici regionali, ai sensi dell'art. 8, comma 2, del D.P.C.M. n. 98 dell'11 febbraio 2014, tra l’altro, vigilano sul rispetto:#delle norme generali sull’istruzione e dei livelli essenziali delle prestazioni, sull’attuazione degli ordinamenti scolastici, sui livelli di efficacia dell’azione formativa e sull’osservanza degli standard programmati#della normativa sulla sicurezza nei luoghi di lavoro, da parte degli enti locali, per il personale non scolastico e sulla programmazione degli interventi relativi alla progettazione e alla realizzazione di nuovi edifici scolastici per le scuole del primo ciclo#dei vincoli economici, relativi alle sponsorizzazioni, delle istituzioni scolastiche#sull’adozione di misure, da parte delle istituzioni scolastiche, finalizzate a promuovere il benessere organizzativo del personale e per lo svolgimento di analoghe azioni per i genitori degli alunni
DOMANDA 1.150#Gli Uffici scolastici regionali, ai sensi dell’ art. 8, comma 2, del D.P.C.M. n. 98 dell'11 febbraio 2014, tra l’altro, curano:#l’attuazione, nell’ambito territoriale di propria competenza, delle politiche nazionali per gli studenti#la realizzazione dei progetti regionali#la definizione dell’offerta formativa regionale#la programmazione degli interventi strutturali e non strutturali nell’ambito delle attività connesse alla sicurezza nelle scuole e all’edilizia scolastica
DOMANDA 1.151#Gli Uffici Scolastici Regionali, secondo l’art. 8, comma 3, del D.P.C.M. n. 98 dell'11 febbraio 2014, sono organizzati in uffici di livello non generale per funzioni e per articolazioni sul territorio con compiti di:#supporto alle scuole, amministrativi e di monitoraggio in coordinamento con le direzioni generali competenti#cura dei rapporti con l'Agenzia per l'Italia digitale, per quanto attiene i processi d'innovazione nella didattica#elaborazione delle istruzioni generali per la gestione amministrativo-contabile delle istituzioni scolastiche#indirizzi in materia di riconversione e riqualificazione del personale docente ed educativo
DOMANDA 1.152#Gli Uffici dirigenziali non generali degli uffici scolastici regionali, secondo l’art. 8, comma 3, del D.P.C.M. n. 98 dell'11 febbraio 2014, svolgono, tra l’altro, la funzione relativa alla gestione delle graduatorie:#e alla gestione dell’organico del personale docente, educativo e ATA ai fini dell’assegnazione delle risorse umane ai singoli istituti scolastici autonomi#del solo personale educativo ai fini dell’assegnazione delle risorse umane ai singoli istituti scolastici autonomi#e alla gestione dell’organico del solo personale ATA ai fini dell’assegnazione delle risorse umane ai singoli istituti scolastici autonomi#dell’organico del solo personale docente, ai fini dell’assegnazione delle risorse umane ai singoli istituti scolastici autonomi e alla convalida delle graduatorie di istituto del personale ATA
DOMANDA 1.153#Gli Uffici dirigenziali non generali degli Uffici scolastici regionali, secondo l’art. 8, comma 3, del D.P.C.M. n. 98 dell'11 febbraio 2014, svolgono, tra l’altro, la funzione relativa:#alla assistenza, alla consulenza e al supporto, agli istituti scolastici autonomi per le procedure amministrative e amministrativo-contabili in coordinamento con la direzione generale per le risorse umane e finanziarie#alla assistenza, ma non alla consulenza e al supporto, agli istituti scolastici autonomi per le procedure amministrative e amministrativo-contabili in coordinamento con la direzione generale per le risorse umane e finanziarie#alla vigilanza rivolta solamente agli istituti scolastici autonomi del primo ciclo, per le procedure amministrative e amministrativo-contabili in collaborazione con la direzione generale per le risorse umane e finanziarie#al supporto rivolto solamente agli istituti scolastici autonomi del secondo ciclo, per le sole procedure amministrative e amministrativo-contabili in collaborazione con la direzione generale per le risorse umane e finanziarie
DOMANDA 1.154#Gli Uffici dirigenziali non generali degli Uffici scolastici regionali, secondo l’art. 8, comma 3, del D.P.C.M. n. 98 dell'11 febbraio 2014, svolgono, tra l’altro, la funzione relativa:#al monitoraggio dell’edilizia scolastica e della sicurezza degli edifici#al monitoraggio dell’edilizia scolastica, ma non alla sicurezza degli edifici#alla sicurezza degli edifici, ma non all’edilizia scolastica#alla gestione diretta dei fondi per l’edilizia scolastica
DOMANDA 1.156#Ai sensi dell’art. 9 del D.P.C.M. n. 98 dell'11 febbraio 2014, il corpo ispettivo, composto dai dirigenti che svolgono la funzione ispettiva tecnica, è collocato:#a livello di amministrazione centrale, in posizione di dipendenza funzionale dal capo del Dipartimento per il sistema educativo di istruzione e di formazione, e, a livello periferico, in posizione di dipendenza funzionale dai dirigenti preposti agli uffici scolastici regionali#a livello di amministrazione centrale, in posizione di dipendenza funzionale dal capo del Dipartimento per il sistema educativo di istruzione e di formazione e per la programmazione e la gestione delle risorse umane, finanziarie e strumentali#soltanto a livello periferico, in posizione di dipendenza funzionale dai dirigenti preposti agli uffici scolastici regionali#soltanto a livello di amministrazione centrale, in posizione di dipendenza funzionale dal capo del Dipartimento per il sistema educativo di istruzione e di formazione
DOMANDA 1.157#Secondo l’art. 9 del D.P.C.M. n. 98 dell'11 febbraio 2014, le modalità di esercizio della funzione ispettiva tecnica sono determinate con apposito atto di indirizzo del:#Ministro#Direttore Generale di ogni ufficio scolastico regionale#Capo del Dipartimento per la programmazione e la gestione delle risorse umane, finanziarie e strumentali#Capo del Dipartimento per il sistema educativo di istruzione e formazione
DOMANDA 1.160#Il D.lgs. n. 112/1998 legifera in merito al conferimento di funzioni e compiti:#amministrativi dello Stato alle regioni ed agli enti locali, in attuazione del capo I della legge 15 marzo 1997, n. 59#per l'adempimento degli obblighi derivanti dall'appartenenza dell'Italia all'Unione europea in materia di istruzione#per l'individuazione delle unità previsionali di base del bilancio dello Stato, con particolare riferimento al contenimento della spesa pubblica#alle regioni per la riforma della pubblica amministrazione e per la semplificazione amministrativa
DOMANDA 1.161#La L. cost. n. 3/2001 ha come oggetto:#modifiche al titolo V della parte seconda della Costituzione#modifiche al titolo IV della parte seconda della Costituzione#riorganizzazione della rete scolastica nazionale#attribuzione dell'autonomia alle istituzioni scolastiche
DOMANDA 1.162#Ai sensi dell’art. 136, comma 1, del D.lgs. n. 112/1998, per programmazione e gestione amministrativa del servizio scolastico si intende:#l'insieme delle funzioni e dei compiti volti a consentire la concreta e continua erogazione del servizio di istruzione#l'insieme delle funzioni volte a consentire l’erogazione del servizio scolastico nelle scuole del primo ciclo#la programmazione delle attività scolastiche nelle istituzioni scolastiche autonome#la programmazione e la gestione dei fondi strutturali europei finalizzati allo sviluppo economico ed all’attuazione delle politiche sociali
DOMANDA 1.163#Ai sensi dell’art. 137, comma 1, del D.lgs. n. 112/1998, allo Stato, tra l'altro, competono:#i compiti e le funzioni concernenti i criteri e i parametri per l'organizzazione della rete scolastica, previo parere della Conferenza unificata#il calendario scolastico e la programmazione dell’offerta formativa#l'istituzione, l'aggregazione, la fusione e la soppressione di scuole#i servizi di supporto organizzativo del servizio di istruzione per gli alunni con svantaggio socio-economico e con bisogni educativi speciali
DOMANDA 1.164#Secondo l’art. 137, comma 1, del D.lgs. n. 112/1998, allo Stato competono anche:#le funzioni di valutazione del sistema scolastico#la sospensione delle lezioni per cause di forza maggiore e la costituzione di reti di scuole#il piano di utilizzazione degli edifici e di uso delle attrezzature#le iniziative e le attività di formazione del personale docente
DOMANDA 1.165#Secondo l’art. 137, comma 1, del D.lgs. n. 112/1998, restano allo Stato:#le funzioni relative alla determinazione e all'assegnazione delle risorse finanziarie a carico del bilancio dello Stato e del personale alle istituzioni scolastiche#l’educazione degli adulti e la relativa offerta formativa#interventi integrati di orientamento scolastico e formazione professionale#la certificazione del programma operativo nazionale del fondo sociale europeo e del programma operativo nazionale del fondo europeo di sviluppo regionale “Ambienti per l’apprendimento"
DOMANDA 1.166#Ai sensi dell'art. 138, comma 1, lettera a), del D.lgs. n. 112/1998, è delegata alle regioni la seguente funzione amministrativa:#la programmazione dell'offerta formativa integrata tra istruzione e formazione professionale#il coordinamento dell’offerta formativa regionale e comunale#il controllo e la gestione delle procedure di reclutamento dei docenti e del personale tecnico-amministrativo#la definizione di bandi per l’erogazione di borse di studio
